created_at,text
Tue Apr 17 07:33:37 +0000 2018,RT @alvsex2: Who wants to join in a sex group to talk about teens and jailbait. RT If u want #wankchat #cumtribute #cocktribute #jailbait #…
Sun Apr 22 01:10:37 +0000 2018,RT @alvsex2: Who wants to join in a sex group to talk about teens and jailbait. RT If u want #wankchat #cumtribute #cocktribute #jailbait #…
Wed Apr 25 15:43:55 +0000 2018,Any jailbait wanna rate my cock? #jailbait #cocktribute #rate #cumtribute #tits #slut #cum #cumslut #nude #nudes… https://t.co/ImwtRI8ZYJ
Tue Apr 17 07:10:24 +0000 2018,DM me girls  #jailbait
Thu Apr 19 21:38:32 +0000 2018,@jailbaited @brokenxans Y would that happen
Sun Apr 22 10:05:01 +0000 2018,@Waifuruu angelina is the prettiest jailbait alive
Tue Apr 10 08:19:15 +0000 2018,"@MercyMuseUwU Jailbait

Good meme source and cool, guy"
Wed Apr 11 05:30:58 +0000 2018,tongue kissing jailbaits https://t.co/1bh708CCqC
Wed Apr 04 11:27:55 +0000 2018,xxx jailbait portals https://t.co/acJuQ467vM
Fri Apr 06 13:33:50 +0000 2018,If only that was a dick in that #jailbait mouth https://t.co/esl09bj6QS
Wed Apr 25 10:34:11 +0000 2018,"The contestants consist of the awkwardly shaped, MILFs, and possible jailbait."
Fri Apr 13 14:48:01 +0000 2018,jailbait braless pornstars on tv https://t.co/oZDqKbvh4u
Sun Apr 08 14:31:12 +0000 2018,jailbait teen wedding photos https://t.co/Rj0Ayb0CPK
Mon Apr 02 15:25:17 +0000 2018,Usually that pedophile #TedNugent the #pedophile loves kids! #Jailbait #girlscoutcookies
Wed Apr 04 08:24:56 +0000 2018,RT @CorallaBrea: #rt if you would fuck me! #sexy #horny #follow #jailbait
Fri Apr 06 03:07:47 +0000 2018,RT @CorallaBrea: #rt if you would fuck me! #sexy #horny #follow #jailbait
Sat Apr 14 23:56:29 +0000 2018,@DistlerJoyce @LizCrokin Type any hashtag like #jailbait and you will see.
Sat Apr 14 15:35:00 +0000 2018,@jailbaited Xd i guess i feel bad for whoever asked it tho
Sat Apr 07 04:48:10 +0000 2018,real jailbait ass pics https://t.co/5R0eOGW47q
Fri Apr 13 18:45:45 +0000 2018,sexy nude jailbait teen groups https://t.co/zfqMnoS04P
Sun Apr 08 23:15:25 +0000 2018,sexy nude jailbait teen groups https://t.co/HihYKxcGiI
Thu Apr 12 05:23:48 +0000 2018,guy jailbait voodoo sex dolls https://t.co/SrTgsThA54
Wed Apr 11 15:29:05 +0000 2018,wwe ariel nude jailbaits gallery https://t.co/TudLLlED7a
Wed Apr 04 14:00:57 +0000 2018,"@RawStory He's such a juvenile pussy - but I guess you are what you eat, right Captain Jailbait Pantshitter?"
Wed Apr 04 18:04:15 +0000 2018,slutty jailbait australian nude photos https://t.co/J0bogc9t7o
Fri Apr 06 11:26:53 +0000 2018,Fan submission: What would you love to do to this slutty #jailbait https://t.co/7dVgtrOPXj
Thu Apr 12 14:15:30 +0000 2018,face sex video erotic jailbaits https://t.co/Zq8dAlQPeY
Thu Apr 12 06:36:10 +0000 2018,fucking teen agers jailbait erotica https://t.co/kkZKvNsbL5
Wed Apr 11 05:20:33 +0000 2018,emo jailbait gifs bisexual mmf tube https://t.co/D0d1YuN1CJ
Sat Apr 07 17:54:25 +0000 2018,japan carnival jailbait naked bouncy boobs https://t.co/RiK34ABQX8
Fri Apr 13 14:20:55 +0000 2018,jailbait sexy pics dildo girl school https://t.co/WJyGWmHMAQ
Sun Apr 08 19:47:30 +0000 2018,free jailbait girl galleries porntube passwords https://t.co/UINyroudto
Sun Apr 08 08:18:00 +0000 2018,sexy jailbait girlfriends hot amateur vids https://t.co/hcMsaTEqqE
Mon Apr 09 05:01:23 +0000 2018,teen jailbait porn oldest sexy moms https://t.co/XEDZX6YdPN
Wed Apr 11 08:50:42 +0000 2018,real jailbait ass pics fucked until she squirts https://t.co/nbpfcNVdJp
Tue Apr 17 22:45:09 +0000 2018,@Clouted @SIeepyTrap @jailbaited //I can't do shit rn but just fuck off. Let people do what they want.
Mon Apr 02 22:30:17 +0000 2018,Who’s horny?? Dm me to get pics! #horny#jailbait#cock#nudes#freenudes
Thu Apr 05 04:03:01 +0000 2018,girls wrestling xxx jailbait porn tube https://t.co/2gl926QQM2
Wed Apr 04 12:52:42 +0000 2018,punjab girl full figure jailbait sex https://t.co/40gRDmyZYB
Thu Apr 05 21:52:08 +0000 2018,porn movies with moms jailbait teen model https://t.co/bgfz9s6xIA
Thu Apr 05 08:26:40 +0000 2018,latex sex gallery young jailbait sex https://t.co/cThQjpt6NK
Fri Apr 06 05:15:26 +0000 2018,pussy fucking games jailbait porn answers where https://t.co/3eh6588hsb
Thu Apr 05 22:18:11 +0000 2018,bleeding pussy movies jailbait porn galleries https://t.co/7ymiFNuRGy
Sat Apr 14 06:33:33 +0000 2018,jailbait tween models hot sexy striper https://t.co/GNXOHtxVdz
Tue Apr 03 13:56:41 +0000 2018,porn lick pussy young jailbait nude https://t.co/vXum0jvy4m
Tue Apr 03 12:38:42 +0000 2018,teen jailbait stories nude satanists girls https://t.co/qYPmcPKi57
Sun Apr 01 11:04:14 +0000 2018,jailbait teen naked porn actresses pics https://t.co/6lT3GkM5Ia
Sun Apr 01 07:56:10 +0000 2018,had sex on the day of ovulation nude jailbait pics https://t.co/9rr4g2g3z6
Mon Apr 02 01:17:34 +0000 2018,sarah vandela anal jailbait fuck pics https://t.co/rJvvQudQxV
Sun Apr 01 15:42:59 +0000 2018,jailbait naked tgp ass sexy xxx https://t.co/YGMkJT6roz
Fri Apr 06 11:22:37 +0000 2018,nude jailbait haveing sex pornstars asses https://t.co/Iz6pkJ6vtv
Sat Apr 07 05:52:08 +0000 2018,fhm girls screwing jailbait girls striping https://t.co/gc29xutZqf
Fri Apr 06 22:54:46 +0000 2018,male fucking machine sexy nude jailbait https://t.co/HXpaPMueZL
Thu Apr 12 08:59:55 +0000 2018,naked asian jailbait southern amateur golf https://t.co/XKh7oVGMv5
Fri Apr 13 04:02:33 +0000 2018,sexy teens haveing sex jailbait blowjobs https://t.co/skkqm621jN
Fri Apr 13 01:27:19 +0000 2018,naked jailbait pictures porno sexy costume https://t.co/6MoVBgLXlv
Thu Apr 12 18:59:26 +0000 2018,naked jailbait freeones girls and boys having sexing https://t.co/TMdMKLaQAh
Mon Apr 09 13:29:54 +0000 2018,jailbait teen hot sex network sites https://t.co/ZOZPdV6ZeJ
Mon Apr 09 12:48:33 +0000 2018,free jailbait movies ebony pornstar midori https://t.co/A5WiGECOX0
Mon Apr 09 18:06:43 +0000 2018,real nude jailbait fashion show nude https://t.co/N9UFcyZPna
Tue Apr 10 15:41:57 +0000 2018,real black jailbait teen tattooed chicks fucking https://t.co/TFEznbo5Mx
Sat Apr 07 13:49:34 +0000 2018,jailbait nude fuck porn movie with good story https://t.co/zpj0ipiYP3
Fri Apr 13 11:04:07 +0000 2018,stacy keibler porn jailbait teen dry humping https://t.co/1vH0ga6P0o
Fri Apr 13 07:57:57 +0000 2018,jailbait sex vid free hd video thong https://t.co/lhXp4bOswY
Mon Apr 09 03:38:07 +0000 2018,young latina fucking naked jailbait girls peeing https://t.co/BUJGbcfX85
Sun Apr 08 09:44:19 +0000 2018,nude girls blogspot com jailbait girls action https://t.co/NLEj0qvUK0
Sun Apr 08 15:08:55 +0000 2018,jailbait nude download gallery noami porn star https://t.co/QZFAyInL2u
Wed Apr 11 22:03:00 +0000 2018,swimming pool naked teens jailbait anal stories https://t.co/ODVjcWXEQc
Sun Apr 15 19:07:00 +0000 2018,JailBait B3NSR [8] obliterated Panda Baby_Stepphen [0] with Dont go Switchin Sides
Mon Apr 02 07:16:35 +0000 2018,black jailbait girls nude naked girls in bahrain https://t.co/nl13daVnGA
Fri Apr 06 02:32:09 +0000 2018,emo teens vids sleeping jailbait porn pictures https://t.co/bAkcvev5DO
Thu Apr 05 10:22:15 +0000 2018,six men on one teen jailbait lesbian seduction https://t.co/ft3Kx0dBJG
Thu Apr 05 06:32:59 +0000 2018,jailbait teens nude black girls nude booty https://t.co/Jqblvy55Dm
Thu Apr 05 22:07:25 +0000 2018,school uniform jailbait naked women of puerto plata https://t.co/zJzaXQmPyW
Sat Apr 14 07:18:48 +0000 2018,see her squirt savannah stern nude jailbait photos https://t.co/qEZoH9LxD2
Sat Apr 14 15:49:44 +0000 2018,Blow your load on me #cumtribute #cumslut #dicktribute #cocktribute #jailbait https://t.co/gDVv1q2evt
Tue Apr 03 20:32:51 +0000 2018,If you're up to #roleplay ill be either gender dm me #jailbait #wankchat #cum #cumtribute #incest #jb
Sat Apr 07 02:33:22 +0000 2018,"vaginal colombiana jailbait office sex ebony boobs 
 https://t.co/0RECJqgtUE"
Fri Apr 06 18:07:04 +0000 2018,jailbait girls on hidden cams nguoi mau nude https://t.co/u2MzLZ5RIP
Fri Apr 13 00:56:40 +0000 2018,videos free sexxxxx fuking jailbait sex portal https://t.co/Fb6JuasnMp
Thu Apr 12 08:37:39 +0000 2018,jailbait girl fucking with man diana doll nude https://t.co/jwOHUFlyyx
Fri Apr 13 03:37:10 +0000 2018,www jailbait only com cartoon network toon porn https://t.co/RDyhUJM819
Mon Apr 09 11:49:28 +0000 2018,sexy teen busty jailbait nude women legs https://t.co/vBkTE5EguZ
Tue Apr 10 01:15:51 +0000 2018,nude jailbait teens pics pleasure without sex https://t.co/CIE8NnIEOI
Mon Apr 09 18:03:37 +0000 2018,black jailbait nepali nude pics and sex video https://t.co/ztBRnSSjDr
Sat Apr 07 13:25:22 +0000 2018,"emo lesbians reality sex jailbait creampie cleanup mexican 
 https://t.co/5QcajkssrD"
Sat Apr 07 15:20:08 +0000 2018,sexy jailbait nudes free thick white naked women https://t.co/2eOEwFk08n
Fri Apr 13 19:46:19 +0000 2018,RT @Jailbaitantonia: Cum for me daddies #cumtribute #cockslap #snowbunny #jailbait https://t.co/ISUlrZlII4
Fri Apr 13 10:17:56 +0000 2018,memphis monroe pornstar experiment daughter hot jailbait nudes https://t.co/om8kKNWelJ
Sat Apr 14 03:03:52 +0000 2018,trinidad women sex videos jailbait teen pictures free https://t.co/yExbMQojWo
Sat Apr 14 04:19:16 +0000 2018,black teen jailbait porn video s russian bdsm https://t.co/Iyi9t4RRBM
Fri Apr 13 06:51:22 +0000 2018,free naked jailbait girl pics porn stories post https://t.co/Z7iObPns3p
Sun Apr 08 20:24:59 +0000 2018,fifty year old nude women jailbait sleeping nude https://t.co/5X2gvd4nIa
Sun Apr 08 15:34:43 +0000 2018,"RT @VickVinegar211: Weird, that's exactly how I feel about pedophiles, Ted.

#Jailbait 
#PedoTedo
#PeleWasOnly17
#CourtneyLoveWasOnly12 htt…"
Wed Apr 11 19:57:53 +0000 2018,pics of nude bihari women jailbait teens pics nude https://t.co/QWTYdztqtQ
Thu Apr 12 04:17:49 +0000 2018,black naked hoes jailbait nonude teen videos tubes https://t.co/C7QKxPAEKs
Fri Apr 20 20:56:07 +0000 2018,RT @Jkilla625: Someone give me a cumtribute 😩🍆🍆 #jailbait #cumtribute https://t.co/VejpvriqDs
Tue Apr 03 03:12:03 +0000 2018,free mobile porn black mulatto jailbait pic girl https://t.co/Nc7G0EOGxX
Thu Apr 05 16:15:12 +0000 2018,RT @stacytell2: get me pregnant #cumslut #cumtribute #jailbait #underage https://t.co/A8cyWvOgGv
Thu Apr 05 19:00:48 +0000 2018,malaysia school girl free fuck movies jailbait amature https://t.co/X5N6lbn9j0
Fri Apr 06 00:55:38 +0000 2018,free naked sexy jailbait watch free online porns https://t.co/UcpvENhCWT
Thu Apr 05 21:06:48 +0000 2018,indian nude black girls pics of jailbait girls having sex https://t.co/PIVNECzJT6
Thu Apr 05 23:41:57 +0000 2018,real naked jailbait free talk to naked women by tagged https://t.co/Rj2VKixOTn
Thu Apr 05 07:11:34 +0000 2018,cheetah girls nude pic free shocking jailbait pic https://t.co/Z0JRsGexHk
Fri Apr 06 04:48:49 +0000 2018,RT @stacytell2: get me pregnant #cumslut #cumtribute #jailbait #underage https://t.co/A8cyWvOgGv
Sun Apr 01 14:56:51 +0000 2018,@mog7546 Out of the mouth of a guy who wrote a song called JAILBAIT! He's coming for your underaged daughters?What a guy! POS!
Sun Apr 01 14:37:53 +0000 2018,RT @Alt_NASA: Ted Nugent's Jailbait Problem https://t.co/jbrb6nCxrN via @HuffPostPol
Mon Apr 02 02:45:03 +0000 2018,RT @ParkerMolloy: Not to mention that he has a song called “Jailbait” with the lyric “Well I don't care if you're just thirteen / You look…
Thu Apr 12 13:39:13 +0000 2018,jailbait teen pictures free free adult xxx stories https://t.co/vfaBq4RILw
Fri Apr 13 00:01:07 +0000 2018,hot naked sexy girls vagueness techno jailbait nude https://t.co/4ioJqoIedN
Thu Apr 12 07:49:00 +0000 2018,jailbait girls porn pictures nude girl fishing video https://t.co/PNbojKUKhc
Fri Apr 13 04:13:01 +0000 2018,free pics hairy jailbait ass black sex tgp https://t.co/ejmRSIyPXp
Fri Apr 13 01:35:57 +0000 2018,jailbait girls in their bras and panties girl showing pussy in public https://t.co/NHnkqaaClR
Mon Apr 16 22:24:04 +0000 2018,RT @WankNation: Which pussy would you smash? 🍑 #cumtribute #cocktribute #jailbait https://t.co/Ml3rGEh5fi
Mon Apr 09 23:30:21 +0000 2018,naked jailbait pics sheva resident evil 5 porn https://t.co/Yg1dUtUbnZ
Wed Apr 11 02:14:43 +0000 2018,Dm me to talk about girls and celebs we find hot #horny #Cum #teens #wankchat #jailbait #cumtribute #cocktribute #as
Tue Apr 10 15:44:39 +0000 2018,RT @Jailbaitantonia: Retweet if I look sexy #cumtribute #cockslap #snowbunny #jailbait https://t.co/KR3FPuZfK0
Sat Apr 07 21:51:06 +0000 2018,RT @Jailbaitantonia: Retweet if I look sexy #cumtribute #cockslap #snowbunny #jailbait https://t.co/KR3FPuZfK0
Sat Apr 07 09:54:21 +0000 2018,RT @Jailbaitantonia: Retweet if I look sexy #cumtribute #cockslap #snowbunny #jailbait https://t.co/KR3FPuZfK0
Sat Apr 07 12:33:59 +0000 2018,"RT @Jailbaitantonia: If you had to choose one, who would you fuck? #cumtribute #cockslap #snowbunny #jailbait https://t.co/W9c2Vn28Nf"
Fri Apr 13 12:27:22 +0000 2018,RT @Jailbaitantonia: Retweet if I’m sexy #cumtribute #cockslap #snowbunny #jailbait https://t.co/azar5itfSV
Sun Apr 08 14:36:06 +0000 2018,free adult breastfeeding videos anal sex jailbait teen buttfuck https://t.co/md6eSstg70
Sun Apr 08 07:28:55 +0000 2018,RT @Jailbaitantonia: Retweet if I look sexy #cumtribute #cockslap #snowbunny #jailbait https://t.co/KR3FPuZfK0
Sun Apr 08 07:30:13 +0000 2018,RT @ronald_gerardus: Wanna do this #Jailbait defenitly but innocent no condom around my cock. https://t.co/W45KuK7WPW
Wed Apr 11 20:43:10 +0000 2018,hot latina girls pics tube of jailbait girls and live sex https://t.co/D5SCEhuN1c
Sun Apr 15 16:06:02 +0000 2018,RT @cumwhoreamy: #cumtribute and #RT for more!! #cocktribute #wanktribute #pisstribute #jailbait #cumwhore #cumslut #cumonme #cumhungry #cu…
Tue Apr 03 02:14:26 +0000 2018,Add the snaps #Youngslut #underage #nudes #nude #girls #Boys #jailbait https://t.co/IgI2mjF8Pw
Thu Apr 05 00:07:49 +0000 2018,RT @EmilyStewart151: 16 and Cum Hungry #cumtribute #cumslut #cumwhore #cumhungry #horny #freak #daddy #jailbait
Thu Apr 05 01:19:03 +0000 2018,free jailbait sexting pics sex porn sport free teen https://t.co/sfbOcNtTkv
Wed Apr 04 22:56:04 +0000 2018,RT @MeganTurner9966: I want cum soooooo bad rn #cumtribute #babygirl #daddy #jailbait #cumslut #cocktribute
Sat Apr 14 23:24:27 +0000 2018,RT @SilvrtonguedDvl: @AquaResurrected @ElNecoV3 @sewervane IIRC he downloaded jailbait pics from a section of 8chan back when Gamergate was…
Sun Apr 01 12:49:23 +0000 2018,RT @OriginalJLP: Just a reminder Ted Nugent is a draft Dodger and a pedophile if the lyrics of his song jailbait are any inclination of his…
Tue Apr 24 11:26:21 +0000 2018,#selling if anyone wants to buy dm me #nudes #jailbait #tits #teenage https://t.co/PqKjHXsr3g
Fri Apr 06 13:03:03 +0000 2018,#Board of #registered #nursing sacramento ca. Jailbait model ass.  CLICK HERE ➡➡➡ https://t.co/KYM5oQ5vrM ⬅⬅⬅
Thu Apr 12 12:25:44 +0000 2018,"RT @xXChibiSenpaiXx: Ute is literally Jailbait for us fangirls.
#yugioh #arcv https://t.co/AQHTDdUlWG"
Mon Apr 09 22:52:24 +0000 2018,RT @Lucysimmons2000: Goodnight guys see you tomorrow 😘  #jailbait #horny https://t.co/8cgHtAn9IG
Wed Apr 11 04:28:27 +0000 2018,RT @Jailbaitantonia: Retweet if you love my little body #cumtribute #cockslap #snowbunny #jailbait https://t.co/QgP440YpZC
Sat Apr 07 21:27:57 +0000 2018,RT @princessky_15: retweet &amp; like and follow for something 🍍 #jailbait #cumtribute https://t.co/rqmqUIWLZK
Fri Apr 13 07:33:10 +0000 2018,Someone chat? Im so #horny and wanna talk 😋 #cumtribute #teen #jailbait #sex #sexy #SexChat 😍
Sat Apr 14 05:44:46 +0000 2018,RT @princessky_15: retweet &amp; like and follow for something 🍍 #jailbait #cumtribute https://t.co/rqmqUIWLZK
Wed Apr 18 11:40:28 +0000 2018,"RT @cheerGirlleader: Hi twitter! First post, first tribute! Who wants to be my daddy?? #lookingfordaddy #daddyslittlegirl #jailbait #little…"
Sun Apr 08 21:12:37 +0000 2018,RT @Jailbaitantonia: Retweet if you love my little body #cumtribute #cockslap #snowbunny #jailbait https://t.co/QgP440YpZC
Sun Apr 08 12:32:42 +0000 2018,RT @Jailbaitantonia: Retweet if you love my little body #cumtribute #cockslap #snowbunny #jailbait https://t.co/QgP440YpZC
Wed Apr 11 17:16:33 +0000 2018,RT @princessky_15: retweet &amp; like and follow for something 🍍 #jailbait #cumtribute https://t.co/rqmqUIWLZK
Sun Apr 15 19:04:20 +0000 2018,RT @princessky_15: retweet &amp; like and follow for something 🍍 #jailbait #cumtribute https://t.co/rqmqUIWLZK
Fri Apr 20 20:05:12 +0000 2018,RT @newagegirlXXI: All happy cause daddy is cumming #jailbait #teen #teenslut #youngslut https://t.co/Rc6YXe5o7w
Tue Apr 03 02:50:37 +0000 2018,"RT @candyluver69: #teenslut #jailbait #highschoolgirl  #teen #puppyteens #puppygirls
I love the puppy-girl  pics..DM me if you have some ht…"
Wed Apr 04 22:39:51 +0000 2018,"RT @highhornygirl: 100rt and I post one without my bra
#cumtribute #teen #jailbait https://t.co/JiBqZiAehh"
Sun Apr 22 01:26:15 +0000 2018,"RT @Avery_Sargo23: follow + rt for a surprise :)
#cumtribute #cumslut #cockslut #cocktribute #slut #cumwhore #jailbait #jailbaitslut #kik #…"
Sat Apr 21 12:51:05 +0000 2018,Anyone wanna #roleplay ill be either gender dm me #jailbait #wankchat #cocktribute #cumtribute #incest #young #jb
Sun Apr 22 07:25:58 +0000 2018,"RT @Avery_Sargo23: follow + rt for a surprise :)
#cumtribute #cumslut #cockslut #cocktribute #slut #cumwhore #jailbait #jailbaitslut #kik #…"
Fri Apr 06 19:12:31 +0000 2018,RT @princessky_15: Where’d my daddies go? RETWEET #jailbait #cumtribute #cocktribute 🍒 https://t.co/xgWF7z5Dch
Wed Apr 25 15:04:28 +0000 2018,#rt for more #jailbait #preTeens #sexyteens #nsfw #teen #amateur #sexy #girls #sweetteens18 https://t.co/Vt7lJJw3gr
Tue Apr 17 00:50:56 +0000 2018,"RT @cheerGirlleader: Hi twitter! First post, first tribute! Who wants to be my daddy?? #lookingfordaddy #daddyslittlegirl #jailbait #little…"
Mon Apr 16 22:47:56 +0000 2018,RT @princessky_15: retweet &amp; like and follow for something 🍍 #jailbait #cumtribute https://t.co/rqmqUIWLZK
Mon Apr 09 21:25:41 +0000 2018,RT @princessky_15: retweet &amp; like and follow for something 🍍 #jailbait #cumtribute https://t.co/rqmqUIWLZK
Tue Apr 10 21:02:53 +0000 2018,RT @mistressjamie99: Retweet and follow if you’d fuck me😋❤❤ #cumtribute #cockslap #snowbunny #jailbait https://t.co/25pb4Im3uj
Tue Apr 10 23:36:50 +0000 2018,RT @Jailbaitantonia: Retweet if you’d cover our pretty faces #cumtribute #cockslap #snowbunny #jailbait https://t.co/wIBhsiUyVc
Wed Apr 11 05:16:23 +0000 2018,RT @Jailbaitantonia: #NewProfilePic retweet if you’d cover me in your cum #cumtribute #cockslap #snowbunny #jailbait https://t.co/Dv686Uaqwa
Sat Apr 07 13:03:38 +0000 2018,RT @tulipnectar: How do i get my dad to fuck me? #daddy #jailbait #cumslave #mistress #findom #underage #lesbian #cumtribute #cumslut #cock…
Sat Apr 07 13:09:54 +0000 2018,RT @yung_sinne: Someonedo this to me ❤️#bbc #daddy #jailbait #cumslave #mistress #findom #underage #cumtribute #cumslut #cockslut #cocktrib…
Sat Apr 07 06:44:58 +0000 2018,RT @97germanwhore: Rate me out of 10. #tits #ass #cumtribute #cumslut #cockslut #cocktribute #slut #cumwhore #jailbait #jailbaitslut Want #…
Fri Apr 13 18:24:20 +0000 2018,RT @mistressjamie99: Retweet and follow if you’d fuck me😋❤❤ #cumtribute #cockslap #snowbunny #jailbait https://t.co/25pb4Im3uj
Wed Apr 18 23:19:19 +0000 2018,RT @mistressjamie99: Retweet and follow if you’d fuck me😋❤❤ #cumtribute #cockslap #snowbunny #jailbait https://t.co/25pb4Im3uj
Wed Apr 18 23:19:19 +0000 2018,RT @mistressjamie99: Retweet and follow if you’d fuck me😋❤❤ #cumtribute #cockslap #snowbunny #jailbait https://t.co/25pb4Im3uj
Sun Apr 08 19:21:55 +0000 2018,RT @yung_sinne: Her moans are so cute #aesthetic #aesthetics #Choke #Fortnite  #cumtribute #virgin #teen #jailbait #sexy #daddysgirl #ddlg…
Thu Apr 12 02:54:30 +0000 2018,RT @HarperAvery13: As promised!! Do U guys like my teenie boobies??? #jailbait #underage #boobs https://t.co/HB2M55O1Vf
Sat Apr 14 13:43:02 +0000 2018,RT @HarperAvery13: As promised!! Do U guys like my teenie boobies??? #jailbait #underage #boobs https://t.co/HB2M55O1Vf
Sun Apr 15 05:25:05 +0000 2018,mpegs russiansex women best teen jailbait japan teenporn hardcore porn downloads non nude beauties free
Tue Apr 03 18:52:47 +0000 2018,"RT @MissFellDragon: “Dragons in Fire Emblem are jailbait.”

Listen; fucko. Do I need to post the scale?

I need to post the scale. https://…"
Sun Apr 01 09:22:22 +0000 2018,"RT @kelly95173274: trying to get to 1,000 followers so please follow for a surprise pic 🤗 #horny #jailbait #teen"
Sun Apr 01 15:08:27 +0000 2018,RT @WankNation: I like to keep my pussy fresh and tight🍑👅Like and RT if you want to stretch them🍆 #cumtribute #cocktribute #horny #jailbait…
Tue Apr 24 21:08:48 +0000 2018,RT @TheHornyPerv: What would you do to Leona? 💦 #teen #teenporn #young #cleavage #sexylegs #legs #tits #horny #jailbait #schoolgirl https:/…
Fri Apr 06 17:13:59 +0000 2018,"lily thai jailbait blacks on blondes deep fuck big butts kinky sex 
 https://t.co/wCF0TpZQd2"
Fri Apr 06 11:15:54 +0000 2018,"RT @its_millie_16: RT these and follow for a chance to win free pics! 

#followme #bodyposi #nudes #jailbait #isellnudes #isendnudes #jailb…"
Fri Apr 06 15:42:07 +0000 2018,RT @yung_sinne: Wish i had some BBC #aesthetic #aesthetics #cutting #Choke #Fortnite  #cumtribute #virgin #teen #jailbait #sexy #daddysgirl…
Mon Apr 16 17:04:16 +0000 2018,RT @tulipnectar: I NEED A SPANKING💖 #aesthetic #aesthetics #cutting #Choke #Fortnite  #cumtribute #virgin #teen #jailbait #sexy #daddysgirl…
Tue Apr 10 21:36:40 +0000 2018,"RT @ellietellent: i'm backkk
rt &amp; follow for a free dm
#cumtribute #cumslut #cockslut #cocktribute #slut #cumwhore #jailbait #jailbaitslut…"
Sun Apr 08 02:27:35 +0000 2018,RT @maddycum2: Cum on my friend please ;)#daddy #jailbait #cumslave #mistress #femdom #underage #lesbian #cumtribute #cumslut #cockslut #co…
Sun Apr 08 04:50:23 +0000 2018,"RT @ellietellent: i'm backkk
rt &amp; follow for a free dm
#cumtribute #cumslut #cockslut #cocktribute #slut #cumwhore #jailbait #jailbaitslut…"
Fri Apr 13 19:49:44 +0000 2018,RT @Jailbaitantonia: Retweet if you’d slap my pretty face with your cock #cumtribute #cockslap #snowbunny #jailbait https://t.co/WsuJk6GU8x
Fri Apr 13 09:24:57 +0000 2018,RT @tulipnectar: RETWEET IF YOU WANT TO FUCK ME DADDY❤️#daddy #jailbait #cumslave #mistress #femdom #underage #lesbian #cumtribute #cumslut…
Fri Apr 13 15:34:47 +0000 2018,self shot teen jailbait nude pics gratuit site for sex fucking beautiful woman https://t.co/MR1MujT65c
Wed Apr 18 19:05:17 +0000 2018,RT @Jailbaitantonia: Retweet if you’d slap my pretty face with your cock #cumtribute #cockslap #snowbunny #jailbait https://t.co/WsuJk6GU8x
Wed Apr 18 19:05:17 +0000 2018,RT @Jailbaitantonia: Retweet if you’d slap my pretty face with your cock #cumtribute #cockslap #snowbunny #jailbait https://t.co/WsuJk6GU8x
Wed Apr 18 06:40:56 +0000 2018,RT @stacytell2: what do you guys think of my little pussy? #horny #slut #cumslut #cumtribute #jailbait #underage https://t.co/Qsx52iKxAq
Sun Apr 08 07:54:12 +0000 2018,RT @softballjess12: Retweet and follow i might dm u💖 #aesthetic #aesthetics #cutting #Choke #Fortnite  #cumtribute #virgin #teen #jailbait…
Sun Apr 15 19:03:22 +0000 2018,RT @Jailbaitantonia: Retweet if you’d slap my pretty face with your cock #cumtribute #cockslap #snowbunny #jailbait https://t.co/WsuJk6GU8x
Sun Apr 15 19:31:03 +0000 2018,"daniella rush jailbait tits and ass anette dawn hermaphrodite sex deep anal fisting 
 https://t.co/i1NcW3TcIu"
Sun Apr 15 09:47:36 +0000 2018,sexandseximage com  free deviant jailbait sex videos  angelica panganiban pussy picture  cycleracenaked   https://t.co/8EWowmQB3Z
Fri Apr 20 12:06:41 +0000 2018,RT @StephanieSirens: RT It's Taboo Sex Day!!! @StephanieSirens #cocktribute #slut #cumwhore #jailbait #jailbaitslut #phonesex #tits #ass #h…
Tue Apr 17 06:49:28 +0000 2018,"Jail Intake 167
👉 https://t.co/J6ta09700B  👈 
 porn dad fingering daughter illegal naked jailbait"
Thu Apr 05 16:16:58 +0000 2018,RT @ZoeFunGirl77: I feel cute today. #cum #cumtribute #cumslut #horny #young #jailbait #babygirl https://t.co/oZM4OQZKiX
Fri Apr 06 05:17:45 +0000 2018,#cocktribute #cumtribute #horny #jailbait #cumslut #nsfw #porn #cumslut #Putiselfies #Putishorts #Putipobre #naked… https://t.co/3Qd6r8C6oc
Sat Apr 14 16:07:55 +0000 2018,RT @stacytell2: why do my tits look so small lol #horny #slut #cumslut #cumtribute #jailbait #underage https://t.co/tFLLmRQSSX
Sat Apr 14 20:31:19 +0000 2018,RT @nsfwprincesss: like if you wanna fill me up 💕 #pussy #horny #latina #cumtribute #cocktribute #cumslut #jailbait #anal #creampie https:/…
Sun Apr 15 01:33:28 +0000 2018,RT @mgaudy1980: #QAnon I saw a tweet about #'s used for disgusting shit on Twitter and sure enough I went to # Jailbait and what pops up un…
Sun Apr 01 16:19:26 +0000 2018,RT @yung_sinne: Rate me out of 10. #tits #ass #cumtribute #cumslut #cockslut #cocktribute #slut #cumwhore #jailbait #jailbaitslut Want #dm…
Sun Apr 01 22:24:15 +0000 2018,RT @yourfckdoll: who wants to #fuck my #tits then #cum all over it? #NewProfilePic 😇 #bigtits #tits #jailbait #teen #young #horny #wet #asi…
Sun Apr 22 16:53:22 +0000 2018,RT @murphysophie404: RT if you’d fuck me #horny #naughty #young #underage #jailbait #wet #cumslut https://t.co/BUIvhiSZ3E
Sun Apr 22 13:53:26 +0000 2018,RT @uglygod234: Arianna’s sweet ass is hungry for a cumstain 🤪 #cumtribute #cocktribute #jailbait https://t.co/QELLOoJ303
Sun Apr 22 19:49:03 +0000 2018,"RT @chlochlothehoe: like and RT if you wanna cum on my face daddy 😍
#horny #cumslut #cumtribute #slut #dmme #jailbait #teen"
