created_at,text
Tue Apr 03 11:44:15 +0000 2018,"RT @Jessextw: Rt if you want to see my boobs😘
#nude #girls #sexy #teen #jailbait #horny #nudes #underage #cock #tits #boobs #ass #bum #boob…"
Wed Apr 04 05:37:55 +0000 2018,"RT @BrickJosephine: Getty horny 

#horny #jailbait #teen #young #sex #pussy #butt #ass #Boobs #tits #anal #girl #hot #masturbate #porn #sex…"
Tue Apr 03 15:10:51 +0000 2018,"RT @Jessextw: Rt if you LOve my boobs😘
#nude #girls #sexy #teen #jailbait #horny #nudes #underage #cock #tits #boobs #ass #bum #boob #cumsl…"
Sun Apr 22 16:24:55 +0000 2018,kim sex stories african porn girls tophairygirls com jailbait girls nude online free watch sarah palin  https://t.co/TtvngSF39R
Sun Apr 22 23:58:38 +0000 2018,"RT @Bby_Mak00: RT for a chance at a free nude. ONE WINNER
#teen #nude #horny #jailbait #slut #young #underage #nudes https://t.co/pB2Oc41tKm"
Mon Apr 23 03:48:07 +0000 2018,jailbait skirt all cartoon porn pics italian adult tv videos porno de mujere bisex porn videos jillian  https://t.co/cFi8s5L1h8
Sun Apr 22 09:09:18 +0000 2018,jailbait uncle nude ancianas pornos nubile bikni redtube sex vidios comedy central adult swim dark asian  https://t.co/zkx0zwVT8g
Sun Apr 22 09:01:23 +0000 2018,"Riding ardently at a casting
👉 https://t.co/Oj8h2Gn3Ir  👈 
 latina facialabuse video jailbait hardcore vids charlen… https://t.co/WqM294mcvU"
Sun Apr 22 06:54:45 +0000 2018,women video chubby blowjob sorority lesbians latex sex gallery young jailbait sex turkies teen agers sexy  https://t.co/PvZGoQ5uu9
Sun Apr 22 22:28:53 +0000 2018,girls strips jailbait teens get completely naked arab lebanon babe sexy black lesbians eating pussy sample  https://t.co/d1zx66HE1F
Thu Apr 19 14:53:42 +0000 2018,latina movies sexy jailbait girls toon porn sites sex stories post movies spanking for sex images tamil  https://t.co/wVsESXHSnj
Thu Apr 19 17:01:04 +0000 2018,fidel castro jailbait mag ashley from rock of love bus naked pics nude raider pics goofy toon porn  https://t.co/kk9vSgBC3l
Thu Apr 19 23:30:03 +0000 2018,games adult early sex free fucking teen vids nude babe doing it adult animated picture jailbait girls fuck  https://t.co/wsyecd4VUw
Thu Apr 19 23:43:41 +0000 2018,krispy kream donut nude calendar girls images aunt nephew porn video ronaldo naked pics jailbait panty  https://t.co/gp8dUju3Ew
Thu Apr 19 10:32:22 +0000 2018,porn tubes porn divx teens jailbait nude ree pussy sexy girls stripping tube videos milfs with hairy  https://t.co/BBHpyAUElO
Thu Apr 19 10:02:53 +0000 2018,felicitas hidden cam jailbait boobs hot and nude lebanese girl sister brother sex free honey milf action  https://t.co/jVs9RWXHxa
Thu Apr 19 09:41:48 +0000 2018,after sex 2007 online jailbait swimming natalie portman sex movie live porn xxx porn har quantam of solace  https://t.co/oYSB9FksZU
Thu Apr 19 09:06:33 +0000 2018,hamilton nude naked bass sex secretes 6th grade naked ebony porn only naked jailbait next door vestal  https://t.co/DIxH3Ti3Py
Fri Apr 20 01:58:43 +0000 2018,free videos indian free sexy jailbait beach vollyball nude ethiopian nud dirty harry porno metal hardcore  https://t.co/5O3Z786aIJ
Thu Apr 19 06:42:59 +0000 2018,chloroformed girls movies learn phone sex sign language porn guy jailbait elizabetta canalis nude dad fuck  https://t.co/UCUb5IeAlJ
Fri Apr 20 05:49:54 +0000 2018,nude jailbait pics her own pussy juice april michelle bowlby xxx biggest cock porn venezuela sex pics sex  https://t.co/EoTa30JUE5
Wed Apr 25 11:17:39 +0000 2018,pussy pics after sex bleeding sexy naked 5th grade girls aang has sex real nude teen jailbait phone  https://t.co/9ucHOmrWDK
Wed Apr 25 06:33:38 +0000 2018,titanic nude painting real sex camera sexy warrior women fuckin mellie nude valley girls nude jailbait  https://t.co/LyLInla8U8
Mon Apr 23 13:24:52 +0000 2018,virinals girls 2 sexy girl videos sexy iran pereteen nude models girls having sex outside hot jailbait  https://t.co/tXZbiTOhTm
Mon Apr 23 19:16:27 +0000 2018,shifter faerie porn adult pirate party games eating fat pussy jailbait teen fucked by teacher cream pics  https://t.co/WuVKV9Dr7g
Mon Apr 23 19:07:55 +0000 2018,ffm sex videos hot jailbait gymnasts sexteen tgp emmanuelle vaugier sexy porns biggest dick anorexic girl  https://t.co/XKh7oVGMv5
Mon Apr 23 11:22:15 +0000 2018,christine fishel naked naked girls next door videos teen sex jailbait free porn site best way of having  https://t.co/UX15XWZgKl
Tue Apr 24 04:38:00 +0000 2018,maduras gratis jailbait girl getting screwed rhona mitra nude video sexy nude pics of anime women kitty  https://t.co/AagfP57SFu
Mon Apr 16 23:42:09 +0000 2018,jobs where can i see nude jailbait girls super sexy hot naked girls anal fucking machine booty pornstars  https://t.co/pO8OHPKRzg
Mon Apr 16 10:04:14 +0000 2018,rough sex farm girls get fucked realsexygirlnude-photos mixed race teen jailbait teen massage xxx xxx  https://t.co/tFrhF3et9x
Mon Apr 16 11:13:28 +0000 2018,hamster stacy keibler porn jailbait teen dry humping amateur mature blow jobs free porn video masturbation  https://t.co/V0Bj0XN7ts
Mon Apr 16 20:41:55 +0000 2018,freev porn videos reese witherspoon nude in twilight www nakedgirl com porne stars nude jailbait thread 18  https://t.co/j3bWQt4vaH
Mon Apr 16 20:41:03 +0000 2018,street latina sex jailbait sex video wetland sex homer simpson on pussy happy hardcore raver anime blonde  https://t.co/vifIVkuF6g
Mon Apr 16 09:31:42 +0000 2018,dad seduces girl galleries girlfriends anal jailbait porn movies nikki rhodes porn movies all dat azz free  https://t.co/gacIUdD6Zx
Sat Apr 07 08:57:00 +0000 2018,"DM #kikme for #ぶっかけ

#cumtribute #cum #cumslut #bukkake #horny #sex #porn #얼싸 #몸싸 #jailbait #slut #エロ #kik #チン添え #素人ぶっかけ #ぶっかけ依頼 #カケコラ #tits"
Thu Apr 19 00:36:32 +0000 2018,anal bigbooty free porn sexo sex xxx teens core sexy women+dance videos actual naked jailbait girls  https://t.co/5On5AF0CDc
Wed Apr 18 17:52:14 +0000 2018,girls pool orgy video 60 sex video smooth girl xxx pics thumbs sexy jailbait girlfriends elephant fuck a  https://t.co/XZSgwWsMCO
Wed Apr 18 17:20:42 +0000 2018,sexy best friends jailbait pool the lesbian sex book porn dong sexy girls naked doing sex drunk mygf nude  https://t.co/P7vQAPdJ1c
Wed Apr 18 21:28:49 +0000 2018,jailbait pics asia argento sex scenes black girls gif xxx girls naked six girl masterbating girl gifs  https://t.co/B3arUUZXi8
Wed Apr 18 06:48:32 +0000 2018,asian models erika fucking free loose pussy pics learn phone sex gana homemade porn guy jailbait voodoo  https://t.co/FwMpXrBfLf
Wed Apr 18 18:12:43 +0000 2018,videos in the world sex indian jailbait teens nude pics virgin girls legs open oral sex disease nude card  https://t.co/vt5gVNyZhn
Wed Apr 18 15:16:21 +0000 2018,pussy  jailbait hot naked  mike hunt porn  free farmer porn  teens butt fucked  old women free sex and  https://t.co/JIsrWwIu0P
Wed Apr 11 21:30:08 +0000 2018,"RT @Jessextw: Rt if you think I look good 😘
#nude #girls #sexy #teen #jailbait #horny #nudes #underage #cock #tits #boobs #ass #bum #good #…"
Sun Apr 15 19:36:52 +0000 2018,girlfriend anal sex meet real sex hornydildo hot sexy jailbait naked molinee green nude pics royal canin  https://t.co/hTNwY40sfL
Sun Apr 15 14:51:21 +0000 2018,girl and boy shower xxx hardcore video free sex videos fisting turner porn nude jailbait girls vids mom  https://t.co/NmrEINyQwi
Sun Apr 15 23:25:33 +0000 2018,hot xxx vixen adult teen jailbait fuck on beach amateur cam live girls sixy donke show vedios on naked  https://t.co/roTsnCNEEN
Fri Apr 20 21:43:41 +0000 2018,women licking pussy pics ukrainian nude pics jailbait sex girl tamil actress sex scandals picture sex teen  https://t.co/8KRllkZcEh
Fri Apr 20 08:53:36 +0000 2018,sex wrestling pornografia de putas hardcore sex gif sexy teen jailbait free humor and sex youporn xom milk  https://t.co/8J8OyD4St5
Fri Apr 20 06:59:13 +0000 2018,fitness girl nude talon sex jailbait girl anal very young porn star indian girl wearing specs nude pics  https://t.co/9TO7mgIIKb
Tue Apr 17 11:39:16 +0000 2018,naked iran female naked parker nude scene official jailbait model forum dancing women naked k9 sex movie  https://t.co/QF5KXacT3T
Sat Apr 21 08:06:16 +0000 2018,hairy pussy courtney cox having sex naked video game good sex topics coco marie sex erotic jailbait pics  https://t.co/agwemXRrC1
Sat Apr 14 13:31:06 +0000 2018,nude boobs pussy nude real jailbait teen 2 hot lesbians having sex nude photos of ex wives a girl gets  https://t.co/j5IvvNboDa
Sat Apr 14 17:14:41 +0000 2018,fucking chimp japanse anal greek jailbait suit porn porn dance tube hell ride nude boobs nude naked  https://t.co/B9u2NyfdE8
Sat Apr 14 10:53:28 +0000 2018,jailbait girls xxx british girle nude message mom pussy cum freeones pornstars free fully nude webcams 69  https://t.co/p6fLaXryOT
Sun Apr 15 03:16:02 +0000 2018,sexey video jailbait fuck sara beth porn over 50 babe girl cries sex drunken orgy best pornwebsites women  https://t.co/UUsaUxnsoq
Sun Apr 15 01:21:48 +0000 2018,chick fucking a huge dildo sex images girl galeri download full adult movie just nude girl jailbait girl  https://t.co/22rDzy2l6p
Sun Apr 15 05:29:38 +0000 2018,hd film casualsex women's anal sex health issues porno de piratas jailbait panty amateur voyeur porn girls  https://t.co/WpFbh20rWH
Sat Apr 14 22:58:24 +0000 2018,sexxxxx fuking jailbait sex portal teens fucking huge cock tennisgirls nude non teen bbs lesbian group sex  https://t.co/0XZqnOckx2
Sat Apr 14 22:26:52 +0000 2018,porn live web cam rate my amateur video homely real jailbait fucking chinese toon porn news anchor sex  https://t.co/KhhmNrNypu
Sun Apr 22 09:17:09 +0000 2018,chick fucking a huge dildo sex images girl galeri download full adult movie just nude girl jailbait girl  https://t.co/2uEgIFsv5p
Mon Apr 23 01:03:34 +0000 2018,best sex only sex videos public anal funk negger nude wiki canal free teenie black ghetto jailbait photo  https://t.co/uB0waaQpnm
Sun Apr 22 06:55:45 +0000 2018,redtube fat pussy free full movie teen porn black teen jailbait african police men fucking police women in  https://t.co/wN1xi8Pp56
Sun Apr 22 22:40:28 +0000 2018,xxx rated milf next door movies https://t.co/XLvxXJyZr0 #adult #sexy #teenslut #jailbait #blowjob #young #squirt… https://t.co/83ZuPWmGqL
Sun Apr 22 22:13:22 +0000 2018,girls  hot big ass fucking  turkish amature sex  jailbait tubes  thaiteen fuk nackt  porno xxx play boy in  https://t.co/MW19JC6JLa
Sun Apr 22 15:33:17 +0000 2018,israeli women jailbait bbs sex arouser stamina women liquid double anal sites wet teen videos blowjobs wwe  https://t.co/QCMaHeKeH7
Thu Apr 19 16:32:40 +0000 2018,filipino pussy nude girls that need money felicia tang porn erotica jailbait sex teen ass naked sexy twi  https://t.co/QszfdimqbT
Thu Apr 19 19:40:11 +0000 2018,"RT @AshanteSky: Rt if you want to see my pus 😘
#nude #girls #sexy #teen #jailbait #horny #nudes #underage #cock #tits #boobs #ass #bum #boo…"
Thu Apr 19 14:37:34 +0000 2018,online adult videos meg family guy porn moms teach teens to fuck jailbait girl fucking with man anime babe  https://t.co/uvQWxeZy63
Thu Apr 19 08:21:28 +0000 2018,girl hotpants jailbait sex older man yugioh dark magician girl naked samus naked hentai hot sex redtube  https://t.co/Yj7D5Sy0a5
Fri Apr 20 03:50:03 +0000 2018,sxy xx vidos  photo cartoon pettit girls sex  icesex xxx/tgp  free nude mexican women lingerie  jailbaits  https://t.co/rVxIYpirFU
Fri Apr 20 03:01:28 +0000 2018,granny women porn nude younest teen galleries jailbait sluts g?rls s?ster boys sex ?deo playboygirls in  https://t.co/ZrGisOLVzg
Thu Apr 19 11:59:11 +0000 2018,fuck hot brazil sex free videos of sexy naked girls naked girlssex jailbait teen holly madison nude photo  https://t.co/qgg6IFJN0h
Thu Apr 19 07:08:57 +0000 2018,gril sex video nudegirls vedio full length sex scenes natalie portman sex clips dadsex porn jailbait teens  https://t.co/hB6opZFlXE
Thu Apr 19 07:21:26 +0000 2018,girlfriend anal sex meet real sex hornydildo hot sexy jailbait naked molinee green nude pics royal canin  https://t.co/pMC7XffvGm
Thu Apr 19 06:39:19 +0000 2018,sex 89 porn movie jailbait girl models nude pic of pregnet girls free xxxpic only nude house cleaning foto  https://t.co/NVsZr2IiVN
Thu Apr 19 15:59:23 +0000 2018,girls sex moble masturbating sex tube kristen stewart nude pussy guide jailbait teen pussy save sex hd  https://t.co/mhu8gmtnvd
Wed Apr 25 03:28:28 +0000 2018,women licking pussy pics ukrainian nude pics jailbait sex girl tamil actress sex scandals picture sex teen  https://t.co/JQRad0thUL
Wed Apr 25 04:29:21 +0000 2018,websites free pornmom max porn sex jailbait nude gif nude bushes birthday sex remix uptempo woman muslim  https://t.co/YWpFg1MzLK
Wed Apr 25 08:54:16 +0000 2018,free naked jailbait girl pics teen lesbian free bbw sex tube mom and son having sex videos nude natural  https://t.co/ljIGTq267m
Wed Apr 25 10:17:14 +0000 2018,nauhty sex best place for jailbait porn nude fantasy sex for women milf mom nude anal infection girls sex  https://t.co/pWZVmCFbZ0
Wed Apr 25 09:52:24 +0000 2018,girl pics of dover tn pics of lauren london naked neighbor girl sex real nude jailbait fashion show nude  https://t.co/y7I4gpmFt6
Mon Apr 23 09:01:38 +0000 2018,2 trailer black sexy fresh video naked jailbait pictures porno sexy costume active adult 55 fuck girl  https://t.co/PkbUK3c3jW
Mon Apr 23 12:19:41 +0000 2018,girls  hot big ass fucking  turkish amature sex  jailbait tubes  thaiteen fuk nackt  porno xxx play boy in  https://t.co/No370vEdjd
Mon Apr 23 18:34:02 +0000 2018,porn videos asian sexy mom wet tight pussy video porno stars galleries kylie minogue pussy jailbait pics  https://t.co/ySleNeJ3to
Mon Apr 16 14:34:11 +0000 2018,girlschoolporn com korea sex forum xxx jailbait swimming man sex with indian school teen live porn xxx hot  https://t.co/rRwAqCvmuw
Mon Apr 16 21:32:11 +0000 2018,sex toys powerpuff girl sex portal girl want to sex jailbait free porn free brazilian porn downloads doa  https://t.co/vHi2YbpgM8
Mon Apr 16 20:13:47 +0000 2018,open pic sex girls in south africa self shot teen jailbait nude pics gratuit site for sex fucking beautiful  https://t.co/O0VaaeoKFT
Tue Apr 17 04:59:21 +0000 2018,pain sex naked teens men free pics of jailbait girls getting fucked sex scene korean sexy things to say  https://t.co/I6CrtYTANJ
Mon Apr 09 22:57:52 +0000 2018,baby you’re pretty &amp; youre 16. possibly one of the worst things... watch men fall over you &amp; call you “jailbait” &amp;… https://t.co/7OFCx182qw
Mon Apr 09 22:59:27 +0000 2018,RT @kikiphillip: baby you’re pretty &amp; youre 16. possibly one of the worst things... watch men fall over you &amp; call you “jailbait” &amp; act lik…
Tue Apr 10 21:14:14 +0000 2018,"#سكس #نيك
sexoengrupo hd granpolla morena milf
jailbaits moan ass tits bitch chat teens girls hotties babes#milfs a… https://t.co/D9msUO8Tzm"
Sun Apr 08 01:39:59 +0000 2018,"I need a young sex slave 😫
#hungry #horny #jailbait #teen #young #sex #pussy #butt #ass #Boobs #tits #anal #girl… https://t.co/ulOiFxe4am"
Wed Apr 18 12:17:41 +0000 2018,teens have sex in spa palo de cote naked geeky sex pic of naked free sex iranian women jailbait babe pics  https://t.co/8hiJB5zbRr
Fri Apr 20 08:32:20 +0000 2018,pailin porno free hot essex girl porn naked women marine gets fucked anal sex photos teen jailbait sex  https://t.co/tzrdldjP1R
Fri Apr 20 10:05:28 +0000 2018,blackwomenfreesex fucking virus men 4sex now teen model jailbait sexy arab legs x x x sex 17girls old  https://t.co/AsIde584ei
Fri Apr 20 11:28:48 +0000 2018,jailbait male men naked us navy sex adult site backdoors anal sex in pictures young tight pink pussy pussy  https://t.co/Lsv6UjlDj1
Fri Apr 20 15:52:26 +0000 2018,models sex teen jailbait model sexy bisexual tgp porn pics mature women young men sex videos sexy clothes  https://t.co/ApfZtyv492
Wed Apr 18 01:17:28 +0000 2018,jailbait one piece bathing suit pool porn pop up free porn sex toy balls adult amature vids naked lesbiene  https://t.co/0jyYvwLA5q
Tue Apr 17 12:06:37 +0000 2018,sex movie porno movie xxx wery teen gay sex horny naturist sexy women thumbs black jailbait girls nude  https://t.co/ZG1FuouJBb
Mon Apr 02 20:57:02 +0000 2018,"#xxx #sex
sexoengrupo hd granpolla morena milf
jailbaits moan ass tits bitch chat teens girls hotties babes#milfs a… https://t.co/YrgR8MHmLP"
Thu Apr 05 20:01:44 +0000 2018,"#سكس #ورعان
sexoengrupo hd granpolla morena milf
jailbaits moan ass tits bitch chat teens girls hotties babes#milfs… https://t.co/6kyNQ4Vmlk"
Sat Apr 14 19:53:15 +0000 2018,jailbait 4chan girl oil sex video black girl naked booty dance sex old women video women getting fucked by  https://t.co/kuEERweB3Z
Sat Apr 14 11:31:29 +0000 2018,tube wiki funny sex pranks naked pics of miley sirus jailbait girl free pics sexy www anal monstar girl  https://t.co/AtE9VLkemT
Sun Apr 15 04:58:49 +0000 2018,girl gets fucked hot girls hogtied nude nangi photo boy girl desi legs russian jailbait nude gta 4 the  https://t.co/TAxVT2J0Zr
Fri Apr 20 00:13:39 +0000 2018,pussy sex vip party freee online porn sex kraz d superstars real jailbait pics russian escort sex ladyboy  https://t.co/sWQvW9jlJY
Thu Apr 19 08:39:20 +0000 2018,free chennai womens hot nude gallery naked wife sex ugly teen fucked hard uk anal jailbait teens sleeping  https://t.co/Lh3KXzkkAy
Thu Apr 19 10:56:50 +0000 2018,hot sex sexy womens high heel naked jailbait porn china girl porno lovely porn clips free streaming porn  https://t.co/fdUPoINTkG
Fri Apr 20 04:50:45 +0000 2018,jailbait booty sean faris sex sexy girl noot girlsoutwest boy girl sandra bullok sex scene free porn movie  https://t.co/ViFoJRFBM3
Fri Apr 13 00:01:52 +0000 2018,RT @HornyTeenSydney: Anyone want to dm ;p #horny #18 #jailbait #nsfw #ass #tits #boobs #girl #teen #freak #girl #boy #hot #woman #legal #da…
Mon Apr 23 14:10:54 +0000 2018,naked pictures hot naked jailbait girls get naked stories naked hot girl pic naked women tatoos young sexy  https://t.co/QePoZ7QX1t
Mon Apr 23 09:58:30 +0000 2018,jailbait girl pictures naked bath house jolene balock nude hot man sexy free black porn big booty sexy  https://t.co/LFjQst0L2n
Mon Apr 16 16:58:58 +0000 2018,jailbait girl pictures naked bath house jolene balock nude hot man sexy free black porn big booty sexy  https://t.co/rVbYeixShL
Mon Apr 16 17:00:28 +0000 2018,jailbait xx porn xx ugly tube porn daddy fukes daughter s girlfrieng naked blonde guys teen school nude  https://t.co/ekEtkF8Zlu
Mon Apr 16 21:49:02 +0000 2018,"Busty gal gets extremely horny while being bounded tight
👉 https://t.co/Wl5PzD0G7H  👈 
 jailbait gf foot fetish spr… https://t.co/HjkaB9BgIY"
Mon Apr 09 21:07:21 +0000 2018,"#xxx #sex
sexoengrupo hd granpolla morena milf
jailbaits moan ass tits bitch chat teens girls hotties babes#milfs a… https://t.co/buuLaGqhG6"
Sat Apr 21 04:00:24 +0000 2018,"Spil Med Min Fisse
👉 https://t.co/8en6OYlemj  👈 
 eros erotica blonde torrent amateur naked underage jailbait girls… https://t.co/I5mtfA8UXo"
Sat Apr 21 11:21:09 +0000 2018,star list hot jailbait porn japan sex video hoi vidio gals sexy xxx trailer teen sex porno video tube8  https://t.co/RgBfB39A7b
Sat Apr 21 18:02:22 +0000 2018,sex videos greek jailbait club magazine porn porn dance tube fat hot nude girls ijn costa rica boobs nude  https://t.co/g5RSDx7Ga2
Sat Apr 14 23:40:23 +0000 2018,uk ray j kim sex video adult anaconda sexy girls in bondage big dick wet pussy kz porn jailbait models  https://t.co/FJg940tPu5
Sat Apr 14 20:03:46 +0000 2018,pussy gina gershan nude 8 mile sex leave porn jailbait next door porn sex girls net free bisexual porn  https://t.co/r1DqBDJuFk
Sun Apr 15 01:01:29 +0000 2018,fuck jailbait cum joanna jojo levesque nude xxx free nudes pic sexy amy rose sex pics hmong sex gril  https://t.co/pxwVqILSTC
Sun Apr 15 05:18:21 +0000 2018,jailbait fucked hard alphateens porn best male sex toy khmer girl porn photo hot girl oral sex nude milf  https://t.co/vbzjpu7k5n
Thu Apr 19 23:29:57 +0000 2018,sex videos greek jailbait club magazine porn porn dance tube fat hot nude girls ijn costa rica boobs nude  https://t.co/j7ls65pBMP
Tue Apr 24 11:42:52 +0000 2018,"TS GF Experience Isa Santos
👉 https://t.co/lZmZBCgnmo  👈 
 ebony dynomite anal porn pornstar maiky cumshot jailbait… https://t.co/IDMm1LUwHq"
Mon Apr 16 08:57:27 +0000 2018,nude jailbait teen teen costa ric free nude teen pix naked prison women boy adult desi online sex movies  https://t.co/vUBPRRKnt2
Sun Apr 15 08:51:11 +0000 2018,porn best nun porn tits teen fuck hardcore leg xxx pic hot jailbait girl pics wild interview sex sex video  https://t.co/SrTgsThA54
Mon Apr 23 00:59:57 +0000 2018,"vl 240P 248.0k 61183851
👉 https://t.co/RsABptKVKk  👈 
 sex xxx anal do bola jailbait cumshot compilation mobile por… https://t.co/NAFhNKw9fg"
