created_at,text
Sun Apr 22 15:48:26 +0000 2018,RT @Tributegaby: Retweet if you’d fuck me in my little black dress #cumtribute #cumslut #cockslap #jailbait https://t.co/UcEqFgNc3W
Tue Apr 24 16:09:58 +0000 2018,It's Taboo Sex Day!!! @StephanieSirens #cocktribute #slut #cumwhore #jailbait #jailbaitslut #phonesex #tits #ass… https://t.co/PySVrZ28gT
Wed Apr 25 01:03:23 +0000 2018,"i fingered my asshole for the first time, it hurts so much #horny #slut #cumslut #cumtribute #jailbait #underage https://t.co/gQ3j7hYP5A"
Fri Apr 06 16:20:44 +0000 2018,http://sex ilovelesb com/sexy-jailbait-tweens html naked men having sex videos https://t.co/fxQpXn8I7u
Wed Apr 25 11:32:24 +0000 2018,"RT @stacytell2: i fingered my asshole for the first time, it hurts so much #horny #slut #cumslut #cumtribute #jailbait #underage https://t.…"
Mon Apr 23 17:01:29 +0000 2018,RT @tulipnectar: RETWEET IF YOU WANT TO FUCK ME DADDY❤️#daddy #jailbait #cumslave #mistress #femdom #underage #lesbian #cumtribute #cumslut…
Mon Apr 16 10:20:49 +0000 2018,"RT @Becca_Send_Nude: Like, retweet and follow for a chance to see this uncovered or you can send a $5 amazon gift card for it. #jailbait #y…"
Mon Apr 09 22:09:03 +0000 2018,RT @Camila_hoe: RT if you’d fuck between @fortnitehoe big lips #cockslap #cumtribute #cumslut #jailbait https://t.co/rY2HyiJUHx
Sat Apr 07 13:25:09 +0000 2018,RT @yung_sinne: Bored rt and i might dm you💖 #daddy #jailbait #cumslave #mistress #femdom #underage #lesbian #cumtribute #cumslut #cockslut…
Sat Apr 07 19:57:02 +0000 2018,@FriendEden100 Coming from a guy who wrote a song called “jailbait” and finds that saying erratic stupid shit is th… https://t.co/zZAHJZYYPY
Sun Apr 08 05:00:37 +0000 2018,RT @aubz110: Who wants a video of me squeezing a banana out of my [hairy] ass? 100 rts and I’ll pick 5. #underage #jailbait #kinky #teen #a…
Sun Apr 08 05:49:45 +0000 2018,RT @aubz110: Who wants a video of me squeezing a banana out of my [hairy] ass? 100 rts and I’ll pick 5. #underage #jailbait #kinky #teen #a…
Sat Apr 14 00:27:46 +0000 2018,"RT @ellietellent: just got back
rt &amp; follow for a surprise ;)
#cumtribute #cumslut #cockslut #cocktribute #slut #cumwhore #jailbait #jailba…"
Wed Apr 18 18:41:08 +0000 2018,largecocksex picture very thin girls taking huge erotic sexual positions jailbait girlfriend homemade close  https://t.co/TP75cSYCh0
Sun Apr 08 21:48:08 +0000 2018,RT @yung_sinne: hi someone please come eat me out 💖💗💘💞💝#daddy #jailbait #cumslave #mistress #findom #underage #lesbian #cumtribute #cocktri…
Sun Apr 08 18:20:44 +0000 2018,Layer me in cum😋my DMs are always open for it #tribute #cumtribute #cocktribute #jailbait #whore #slag #slut #tits… https://t.co/neZcbd1XPz
Sun Apr 15 14:08:52 +0000 2018,bend over teens  real jailbait naked  nude college parties  nude lapdances  philippine sexgirls  amputee  https://t.co/c3oK2L3MB5
Mon Apr 16 02:35:12 +0000 2018,hispanic girl jailbait daughter girl with glasses reality porn chinese couple having sex first threesome  https://t.co/weWPx4PbfI
Mon Apr 16 04:37:29 +0000 2018,painting xxxsexy girls movie pictures blowjobs porno fingering lightskinned pussy jailbait girl sexey  https://t.co/87RfP8ZUHt
Sun Apr 15 12:58:28 +0000 2018,fucking a divorced woman sex clips hillary scott porno jailbait fingering carrie from mythbusters nude  https://t.co/gXPhcaeaat
Fri Apr 20 13:59:17 +0000 2018,RT @Courtnayy215: Anyone ever fucked pregnant pussy?  #cumslut #escort #sugarbaby #jailbait #bbc #snowbunny https://t.co/WltJC6JkHq
Fri Apr 20 19:41:51 +0000 2018,"RT @plzloveme1278: Rt and like and follow to get her nudes, must do all three and I'm checking😘 #Jailbait #teen #tits #nude #follow #hmu #f…"
Fri Apr 20 07:27:47 +0000 2018,"RT @givemeaminate: like and RT if u wanna bend me over and fuck me hard doggy style 
#horny #cumslut #cumtribute #slut #jailbait #teen"
Tue Apr 03 02:30:20 +0000 2018,RT @papasmith323: Like this post for a nude in your DMs. #RETWEET for a video. #horny #anal #ass #thicboy #bbc #gay #bisexual #jailbait #bi…
Sun Apr 15 01:22:53 +0000 2018,row 2 shandi naked nonnude sports girls adult video downloader jailbait sex pics model nn porn teen
Sun Apr 15 05:46:55 +0000 2018,blindfolds girlfriend and she sucks and fucks his friend top8 porn nude jailbait vids danielle derek sex  https://t.co/mUJ64tXNA2
Sun Apr 15 05:24:28 +0000 2018,hansika motwani xxx ts sex videos jailbait nude hairy playboy girls getting boned israeli girls thong sex
Tue Apr 03 17:50:46 +0000 2018,Dime #sexy #sex #girl #boobs #ass #pussy #porn #fuckme #hot #jailbait #horny #bisexual https://t.co/hZc1HCtn8U
Sun Apr 01 16:23:33 +0000 2018,"RT @Bby_Mak00: RT for a chance at a free nude! 
#nudes #young #hot #horny #underage #teen #jailbait https://t.co/rby2YTDLvf"
Sun Apr 01 17:25:20 +0000 2018,RT @shannon_slut1: Who wants to see my ass? 💦👅 #cumslut #cumwhore #horny #teen #jailbait #jailbaitslut #slut #fucktoy #pussy #littletits #f…
Sun Apr 22 07:34:44 +0000 2018,women sex pic streetblowjobs morgan how to have great sex with your wife black-jailbait pics amateur vido  https://t.co/NAsQYC4d2H
Fri Apr 20 02:32:46 +0000 2018,"RT @plzloveme1278: Rt and like and follow to get her nudes, must do all three and I'm checking😘 #Jailbait #teen #tits #nude #follow #hmu #f…"
Fri Apr 20 02:50:11 +0000 2018,"RT @ellietellent: just got back
rt &amp; follow for a surprise ;)
#cumtribute #cumslut #cockslut #cocktribute #slut #cumwhore #jailbait #jailba…"
Fri Apr 20 03:16:48 +0000 2018,RT @Cumslut_Jade: rt/fav if you wanna fuck me 😘 #horny #teen #jailbait #latina #cumtribute #cocktribute https://t.co/qScsCxXXSc
Thu Apr 19 11:08:41 +0000 2018,goddess sex stephanie moore fuck vedios amateur couple fucking in bed jailbait treeteen alessandra  https://t.co/ixiMyrcvFH
Fri Apr 06 08:34:54 +0000 2018,RT @jakes165: #young #teen #boy #jailbait #cum #cock #essex #uk #horny snapchat jakes165 https://t.co/HYn76gja8s
Thu Apr 12 12:31:21 +0000 2018,HUGE COCK FOR ONLY GIRLS Dmme to check it out 🔥#cocktribute #jailbait #girls #horny #bigcock #bigdick #nudes… https://t.co/62NgwNFrqw
Thu Apr 12 15:57:41 +0000 2018,Also liked screwing underage girls read lyrics to jailbait he talks about screwing an underage girl and sharing her… https://t.co/f59smyTrEl
Mon Apr 23 23:29:42 +0000 2018,RT @71Emzy: DM me if your interested in buying vids or pics. I have a lot. Dm me  ❤️ #selling #nudes #jailbait #underage #tits #ass #vagina…
Mon Apr 23 10:33:12 +0000 2018,jailbait teens nude  teensexporn ge  the most beautiful boobs in the world naked  fat womens porns movies  https://t.co/nZlNjsNN0s
Sat Apr 07 17:45:56 +0000 2018,RT @Jailbaitantonia: So excited to start my twitter❤️ Retweet if you’d fuck me😋 #cumtribute #cockslap #snowbunny #jailbait https://t.co/qDN…
Sat Apr 07 23:14:11 +0000 2018,RT @207sophs: Little lease 😉😈 #dropbox #dropboxlinks #jailbait #jailbaitslut #horny #cumslut #cumwhore #cum #tits #ass #pussy #underage #ho…
Wed Apr 18 13:43:59 +0000 2018,jailbait  pubescent girls peeing  hayley erin porno  tong sexmovie  malayalam sweet hot girls porn   https://t.co/cFIkHRmhI2
Thu Apr 19 04:57:26 +0000 2018,vergin vagin naked women lacrosse players africa school porno photos sexy jailbait porn actresses  https://t.co/WA3KP3ybow
Wed Apr 18 12:37:33 +0000 2018,girls nude volleyball anal movies thumbs massage jailbait public sex offender this thread fucking sucks  https://t.co/UalTfg6WKW
Mon Apr 09 01:40:51 +0000 2018,RT @WankNation: I need a cock in me right now🍆 like and RT to please help me cum 🍑💦 #cocktribute #cumslut #cumtribute #jailbait #horny http…
Sun Apr 08 15:47:37 +0000 2018,RT @Becca_Send_Nude: Selling my nudes DM me for prices #jailbait #horny15 #young #teen #tits #follow #hmu #fuck #sex #fuckme #lesbian #nude…
Wed Apr 11 22:15:37 +0000 2018,RT @KnightlyAshlyn: What would you guys do to these 2 young sluts sisters Taylor 17 and Ashley 15 #sluts #sisters #jailbait https://t.co/vC…
Sun Apr 15 09:41:11 +0000 2018,black ass online adult christmas games sleepover games for teenagers jailbait cute hardcore scene ardsley  https://t.co/a8wHJz5Wxz
Sun Apr 15 12:42:55 +0000 2018,RT @DillionVictoria: 100 rt and ill post some more ❤️😘 #jailbait #premium #latina #underage #sexy #blowjob #pussy #ass #tits #porn #hispani…
Fri Apr 20 16:44:54 +0000 2018,guys strap on sex sex with girle sleeping jailbait old american porn punjabi nude porn pictures in you  https://t.co/uyMMKYyvs6
Fri Apr 20 17:21:46 +0000 2018,whats in sex on the beach group of teen porno jailbait girls hairy pussy naked the brazilian girls pussy  https://t.co/fHI7ini2HZ
Fri Apr 20 07:07:21 +0000 2018,guys strap on sex sex with girle sleeping jailbait old american porn punjabi nude porn pictures in you  https://t.co/hu4KOZ5V0Q
Tue Apr 17 14:32:18 +0000 2018,nude teen pics jailbait girlfriends sex movies how to invest in porn girls high on weed having sex video  https://t.co/k4KDmQQfDG
Wed Apr 18 04:02:10 +0000 2018,sex jailbait pics mexican anime girls having sex free hard core porno polandnudegirls actresses nudes  https://t.co/m5kFxN3TZK
Tue Apr 17 12:30:38 +0000 2018,literotica male teacher fucking girl students sexy maori nude jailbait masterbating nepali homemade sex  https://t.co/gNQFImfe3L
Mon Apr 02 09:05:37 +0000 2018,RT @shannon_slut1: Wanna see me without the bikini? 😏 x #cumslut #cumwhore #horny #teen #jailbait #jailbaitslut #slut #fucktoy #pussy #litt…
Sat Apr 21 19:13:59 +0000 2018,blowjob movies jailbait nude pics teradise island anal black porn for mobile phone hotgirlfucking homemade  https://t.co/iwPtSgNEXn
Sat Apr 21 21:05:45 +0000 2018,stories of hitchickers fucking the amateur amateur jailbait almost nude pics is anul sex safe www sister  https://t.co/7ATDZ5TsgS
Fri Apr 06 04:20:15 +0000 2018,RT @califorgirl12: DM if you wanna see me take it off #porn #teen #sexy #nude #fetish #jailbait #wank #wankchat #dmme #sex #cum #cumtribute…
Sat Apr 14 14:46:00 +0000 2018,@Vindic8tr @fbi @potis @TheHoneybee_  @Fulcrum__News  @SGTreport  VOAT WHO HOSTS JAILBAIT forum says I posted CP (L… https://t.co/RyplY5AaAH
Sun Apr 15 04:08:12 +0000 2018,dating my wife watching porn group sexual positions female jailbait blonde fucked behind sex with sexy  https://t.co/yJUan8fOXj
Sun Apr 01 21:05:21 +0000 2018,RT @BrandyMoore_: RT if you’d like to see me nude :) #teen #horny #cum #cumslut #jailbait #young #cumslave #cockslave #cumtribute https://t…
Mon Apr 02 03:58:47 +0000 2018,RT @BrandyMoore_: RT if you’d like to see me nude :) #teen #horny #cum #cumslut #jailbait #young #cumslave #cockslave #cumtribute https://t…
Sun Apr 22 19:38:04 +0000 2018,"best blow job ever jailbait alexis love sex moves gag porn old man fucking 
 https://t.co/imsZ44ennk"
Sun Apr 22 11:46:04 +0000 2018,pics  hydrasex  girls theatre having sex with school boy porn video  real teen jailbait pics naked   https://t.co/vUc4NHMnsK
Thu Apr 19 17:48:25 +0000 2018,michelle softcore porn myanmar girl naked body jailbait videos uncensored sex and the city season 6  https://t.co/yUReJ53RdF
Fri Apr 20 03:36:17 +0000 2018,private adult photo naked jailbait picture how to know if a girl wants sex sex positions for fat people  https://t.co/RacjA9SbVz
Wed Apr 25 03:52:09 +0000 2018,youpornorgie linda darnell nude authentic nude jailbait pics ebony pornmovies april michelle bowlby xxx  https://t.co/ZKzx277jzV
Fri Apr 06 17:52:43 +0000 2018,RT @tulipnectar: Bored rt and i might dm u💖 #aesthetic #aesthetics #cutting #Choke #Fortnite  #cumtribute #virgin #teen #jailbait #sexy #da…
Fri Apr 06 11:57:36 +0000 2018,RT @WankNation: How hard would you fuck?🍆 Like and RT to play 🍑 #cumtribute #cocktribute #horny #dirtytalk #jailbait https://t.co/XbOMu7LdRB
Sat Apr 07 04:09:14 +0000 2018,RT @Lucysimmons2000: Lucyy doesn’t trust no hoe ✂️ #cumtribute #horny #slut #jailbait #dm #thong https://t.co/YpyzsuhhKW
Thu Apr 12 08:38:46 +0000 2018,"RT @xxxNudeTeens: Left or Right?
#porn #teen #sexy #nude #fetish #jailbait #wank #wankchat #dmme #sex #cum #cumtribute #cock #cocktrubute #…"
Mon Apr 23 14:25:04 +0000 2018,girls movies pornstar with huge ass nude jailbait sex canoeing nude camwithher carmen strips nude out of  https://t.co/KbwWXBgn48
Tue Apr 10 03:34:10 +0000 2018,We’re back!!! Plz #cumtribute us #teen #jailbait #cumsluts while we’re still awake! #cumshot #bbc #blackcock… https://t.co/V5m0b1dt2a
Thu Apr 19 00:09:58 +0000 2018,that has sex cig girl sexy jailbait girl sex videos naked girls free tags how to suck a girls pussy  https://t.co/auTE0j6TxR
Wed Apr 18 21:47:06 +0000 2018,of naked jailbait teens for free african queen nude drugged women nude marilyn monroe sex icon free  https://t.co/f4uiHHHTVJ
Thu Apr 19 04:44:14 +0000 2018,girlsgirlssexi twerk naked turkish girl get spanked jill eikenberry nude nude real jailbait teen sexwality  https://t.co/u9ZzfzloJf
Mon Apr 16 00:26:45 +0000 2018,jailbait pictures trini porhn naked trini women dad and girl nudity hardcore lesbians licking pussy online  https://t.co/YnFsZqELmS
Mon Apr 16 02:21:24 +0000 2018,nude sex  nude european jailbait  mature in adultshop tubes  amature porn gif  free hotel sex videos with  https://t.co/0ctpHX8P6Z
Sun Apr 15 10:29:07 +0000 2018,blowjob video nude enrique iglesias jailbait sex kristina reyes naked brothers band hot black girls  https://t.co/T83WpctNmM
Fri Apr 20 16:44:56 +0000 2018,woman asian swimsuit sex see her squirt savannah stern nude jailbait photos sexgirl movie cock in butt  https://t.co/evewFOHWB7
Fri Apr 20 19:12:54 +0000 2018,RT @Tweet666661: #cum #bigdick #bigass #teen #jailbait #young #straight #girl #horny #tits #ass #girl #nsfw #naked #porn #camgirl #livecam…
Sat Apr 21 00:06:23 +0000 2018,outdoor sex video small sons how to sex a kitten pornstar with big booty jailbait sexy nudes free naked  https://t.co/V2dFzy7f5V
Sat Apr 21 03:25:49 +0000 2018,scandal picture girls that are hot and sexy miss piggy porn british porn industry teen jailbaits nude sexy  https://t.co/cNACrt69z9
Tue Apr 17 08:31:49 +0000 2018,nude nude tenten full porntv kashmiri naked sexy girls photos during sex scandal jailbait pants naked  https://t.co/b0Zm1SlFqc
Wed Apr 18 05:17:54 +0000 2018,100 girls download sexy girls jailbait teen lesbians aquarius woman and sex surveillance video sex lusty  https://t.co/eMfbMZzkNv
Sat Apr 21 19:35:14 +0000 2018,kama sutra sexual positions pictures dildo girls pics jailbait girls foot fucking my best friends girl  https://t.co/7fPg2wj1Fx
Sat Apr 21 14:46:14 +0000 2018,brooke hogan nude playboy africanamerican women haven sex black teen strip tube jailbait photo nude  https://t.co/wXYGcmgVC4
Sun Apr 22 03:13:22 +0000 2018,pictures sexy light skinned black girl youporn mobile site sexparty tb jailbait teen fucked australian  https://t.co/nEQk2Cd57P
Sat Apr 21 07:07:01 +0000 2018,bangalore sex videos adut sex naked lady cufflinks jailbait pics mexican had sex with best friend free  https://t.co/Sk289m9P7c
Sat Apr 14 21:32:06 +0000 2018,women sex white boy porno israeli clip jailbait beach older lesbians fucking younger lesbians pictures of  https://t.co/w7mPJO0LFH
Sat Apr 14 23:58:38 +0000 2018,sexiest ass jailbait girls fuck extreme porn list anarecksic teen fuck best adult halloween costumes  https://t.co/dhFl2QvGEC
Sat Apr 14 23:10:21 +0000 2018,amateurs jerking off real nude jailbait girls download pics of old man on teen atk dominican babes black  https://t.co/LzcRaUuwqG
Sun Apr 15 04:19:05 +0000 2018,bazilian teen a girl and a boy haveing sex naked jailbait nude forum www mongolianwomenude com sex world  https://t.co/VIcIJi6kvI
Sun Apr 01 16:16:16 +0000 2018,"Ted Nugent's disgusting lyrics from jailbait. Roy Moore's favorite song. Gun owning pedofiles stick together.
Just… https://t.co/nFYIS7f9wu"
Sun Apr 01 13:47:47 +0000 2018,"RT @pacelattin: ""Well, I don’t care if you’re just 13

You look too good to be true

I just know that you’re probably clean...

Jailbait yo…"
Sun Apr 01 18:55:00 +0000 2018,"RT @sexycouple220: Wet pussy who would lick it xxxx💦💦💦
#hot #horny #jailbait #milf #curves #hotwife #slutwife #VideoViral ❤️ https://t.co/r…"
Sun Apr 22 19:20:38 +0000 2018,picture teen anal fisting gallery jailbait yoga pants pics naked chicks on beach naked girl in sandaler  https://t.co/AH1zE1Sja0
Mon Apr 23 00:20:04 +0000 2018,licking eachothers pussys jailbait braces nude men in the shower big fat girls fuck squirt facial indian  https://t.co/cI1uxadXQw
Mon Apr 23 00:20:04 +0000 2018,licking eachothers pussys jailbait braces nude men in the shower big fat girls fuck squirt facial indian  https://t.co/cI1uxadXQw
Thu Apr 19 19:17:22 +0000 2018,kane naked mother eats daughter pussy internet porn simulator full figured nudes having sex jailbait teens  https://t.co/BmolB8YFjd
Thu Apr 19 14:32:25 +0000 2018,girl older nude photos asian jailbait nude nakedfuckingteens best porn site for mallu nude pictures hot  https://t.co/iArBpnRMGQ
Thu Apr 19 21:26:48 +0000 2018,RT @Briannacutiexo: who wants it?😍❤️🔥💥 hmu teens 15-19 no one else!! #Youngslut #teens #teen #jailbait #young #cum #cuntribute #cocktribute…
Fri Apr 20 02:25:20 +0000 2018,home most fucking sexy jailbait porn strip girls sex teen in nylon divx sexy denise richards sexscene  https://t.co/o5IfV09yd2
Thu Apr 19 08:52:08 +0000 2018,athletic women porn gallery asian tiny sex real nude jailbait pussy galleries sex position picture  https://t.co/MTviAUTbNF
Sat Apr 07 04:38:43 +0000 2018,"happy legality, bandmate!!! congrats 'di ka na jailbait hahaha ily you'll always be my babygirl @jeanebilog catch s… https://t.co/rI2N7FEoiC"
Wed Apr 25 14:32:13 +0000 2018,girls xxx free oral videos jailbait nude gallery free titty fucking videos lesbian and teen amateurallure  https://t.co/NEclvb8vzi
Tue Apr 24 02:56:29 +0000 2018,naked teens sex kittens movis porno free soft jailbait britishsexygirls lesbins teens gizli kamera pornosu  https://t.co/uyMMKYyvs6
Tue Apr 24 02:17:24 +0000 2018,girl fucked pics free porn pics black friends mom fucking leotard jailbait the most beautiful girl naked  https://t.co/QmJ4vQF3PM
Tue Apr 24 03:55:36 +0000 2018,thighs jailbait philippine teen fuck xxx porn blogspot show adult movie ameture naked pictures of my pussy  https://t.co/m3LwPx12MQ
Mon Apr 23 12:28:09 +0000 2018,merilyn sakova nude naked bald pussy free adult television channels porno young free jailbait having sex  https://t.co/lqPQYayBBa
Mon Apr 23 12:57:39 +0000 2018,pictures  skinny nude teen jailbait pics  fish in girls pussy pics  sexy prostate gallery  latvian girl  https://t.co/79onrks1K1
Tue Apr 17 03:52:07 +0000 2018,tabitha gilley nude jailbait peaches porn1900 caught porno sheree j wilson porn most bizzare sex budding  https://t.co/YdSdNlgQje
Mon Apr 16 20:52:16 +0000 2018,girls naked drunk pinay hardcore photo nude topless photo little melissa jailbait forum pakistani naked  https://t.co/Djf5zDfD46
Mon Apr 16 20:50:15 +0000 2018,control amateur web cam sites singapore sexy partner savita rose anal unconscious nude jailbait girls  https://t.co/RDzoY1nuMy
Mon Apr 16 09:52:10 +0000 2018,pics of sexy girls masturbation teen virgin vanessa hudgens sexs girls fuck in shower sex teen jailbait  https://t.co/iGjtgQc7PY
Mon Apr 16 07:04:01 +0000 2018,goddessporn galley games naked granny ass free latina hardcore naked jailbait pics public sex in france  https://t.co/MqxOUxbc7d
Mon Apr 16 12:58:53 +0000 2018,nude  sex anime teen with skeleton  free clips of naked jailbait cartoon girls  pronstar lita wwe  small  https://t.co/iPzVesH6Ly
Mon Apr 16 18:22:50 +0000 2018,jailbait upskirt pussy girl fucks a blow up doll lesbians in wetsuits naked girl gone wild albania porn  https://t.co/NTXj04zOc9
Mon Apr 16 18:57:29 +0000 2018,fuck russian titfuck cheerleaders girls nude jailbait girls on cam story teen xxx girls getting fucked and  https://t.co/vZQdF1Vp0c
Mon Apr 16 15:41:29 +0000 2018,glasses spanishpornsex around nude naked jailbaits pics animated adult avatars sister sex hot pic julian  https://t.co/ljQlX306d2
Wed Apr 11 05:47:10 +0000 2018,"#cum #bigdick #bigass #teen #jailbait #young #straight #girl #horny #tits #ass #girl #nsfw #naked
Choose from left… https://t.co/CyiQjgLxTm"
Wed Apr 18 16:26:59 +0000 2018,sex dance jailbait girl getting naked latina girl fucking maltese adult campus invasion porn full free  https://t.co/KphZrAVrxN
Thu Apr 19 00:06:41 +0000 2018,naked pageant girl nudist jailbait have sex shemales gun pics indian college nude girls girl fuck troll  https://t.co/ViSIUwZBea
Thu Apr 19 02:02:46 +0000 2018,toy story adult costumes aish porn amateur uk jailbait free hardcore porn pix search for a pornstar xxx  https://t.co/x5lxOz9mHA
Wed Apr 18 08:31:36 +0000 2018,RT @iloveyou1278: 10 min for 7 followers and you guys get free nudes😘💦 #Jailbait #teen #tits #nude #follow #hmu #fuck #sex #fuckme #lesbian…
Thu Apr 19 04:51:01 +0000 2018,jailbait skinny dip pics porn of old men xxxporn co bisexual info kendra wilkinson totally naked porn  https://t.co/SKhRTr8908
Mon Apr 16 00:13:00 +0000 2018,gratis de colombianas teddy bear fuck anime girl pic pretty body naked sexually assaulted jailbait sexy  https://t.co/02aE5r9paJ
Sun Apr 15 17:03:24 +0000 2018,porn butt sex demons fucking women double anal jailbait hardbody jennifer aniston naked gag report girls  https://t.co/hKjSbXv87h
Sun Apr 15 21:39:15 +0000 2018,jailbait database best teen bikinis lot nude ebony panties porn daddy nude pictures alyssa milano nude  https://t.co/3EN5jjEbSy
Sun Apr 15 08:14:12 +0000 2018,free mature porn videos sexy jailbait angels adult female toy teenxxxitaliane b naked find a sexy date at  https://t.co/f5G3oqbbY7
Mon Apr 16 04:42:53 +0000 2018,jailbait nude body painting pics pop up free porn sexm adult amature vids gilian chung nude to become a  https://t.co/hbSdzIrGMp
Sun Apr 15 22:50:13 +0000 2018,porn videos lebanesenudegirls msn smiley adult teen sex za who invented oral sex jailbait bikini vids best  https://t.co/MoAuf9OYiW
Fri Apr 20 23:35:26 +0000 2018,winters nude sleeping nude punjabi girl sex video sex verhaal girlguiding essex black jailbait girl naked  https://t.co/ZEQqSeOWqF
Fri Apr 20 08:35:42 +0000 2018,hamilton nude naked bass sex secretes 6th grade naked ebony porn only naked jailbait next door vestal  https://t.co/gqx4GgLT4c
Fri Apr 20 08:49:30 +0000 2018,site torrie wilson nude picture hawaiian teen get fucked free adult breastfeeding videos anal sex jailbait  https://t.co/dZz3h0AUsm
Sat Apr 21 03:52:49 +0000 2018,"RT @Bby_Mak00: RT for a chance at a free nude. ONE WINNER
#teen #nude #horny #jailbait #slut #young #underage #nudes https://t.co/pB2Oc41tKm"
Fri Apr 20 15:44:47 +0000 2018,jailbait girl pics porn stories post bbw sex tube sexcarnivalorgy nude natural pics kate bekinsale nude  https://t.co/g8s7NWvYBh
Wed Apr 18 00:22:09 +0000 2018,"Stud strokes his footlong cock until he cums
👉 https://t.co/DIh5ruoNS8  👈 
 skymovieporno virgin jailbait teen as s… https://t.co/YP0sHXg5sh"
Tue Apr 17 23:01:24 +0000 2018,jailbait tube legal age have sex nude blay boy woman hot japanese models shower see a hardcore fairytale  https://t.co/u7jb4qWyjJ
Tue Apr 17 11:07:38 +0000 2018,jailbait nude pics menstrual bleeding after sex male sports stars naked hot sex party england nude sexy  https://t.co/puhVjcb1FT
Wed Apr 18 01:36:24 +0000 2018,sex magic charlie sheen naked volleyball jailbait ebony teens fuck what is sex videos live sex chat free  https://t.co/x6llobftKf
Tue Apr 17 06:50:51 +0000 2018,games adult early sex free fucking teen vids nude babe doing it adult animated picture jailbait girls fuck  https://t.co/OLksHqCP5D
Thu Apr 05 02:30:36 +0000 2018,RT @Godddess_Jaz: You horny ? Dm me😘  #cum #cumtribute #horny #young #jailbait #teen #lesbian #girl #milf #hot #real #xxx #porn #nsfw https…
Thu Apr 05 03:33:44 +0000 2018,RT @Godddess_Jaz: You horny ? Dm me😘  #cum #cumtribute #horny #young #jailbait #teen #lesbian #girl #milf #hot #real #xxx #porn #nsfw https…
Thu Apr 05 03:37:40 +0000 2018,RT @Godddess_Jaz: You horny ? Dm me😘  #cum #cumtribute #horny #young #jailbait #teen #lesbian #girl #milf #hot #real #xxx #porn #nsfw https…
Wed Apr 04 20:55:42 +0000 2018,"RT @Lex_slut2000: Who wants to buy my nudes or vids?
#teen #nude #horny #slut #sex #sexy #jailbait #nudes #barelylegal #ass https://t.co/Kd…"
Sat Apr 21 19:54:19 +0000 2018,jailbait girls making out sex videoxxx sexy girl commercial bi sex hardcore afro samurai sex scene teeners  https://t.co/RjigTU6JKc
Sat Apr 21 23:25:27 +0000 2018,http://sex ilovelesb com/sexy-jailbait-tweens html madra girl having sex bj slater porn northwest adult  https://t.co/EWjYq8dNQJ
Sat Apr 21 11:05:10 +0000 2018,beautifuf nude older mammas vids free hard core teen porn clips pictures of naked blonde jailbait cigar  https://t.co/yqIwK70ghC
Sun Apr 22 05:30:43 +0000 2018,free videos indian free sexy jailbait beach vollyball nude ethiopian nud dirty harry porno metal hardcore  https://t.co/2r0OWoLpMs
Sat Apr 14 16:43:30 +0000 2018,jailbait claude-christian virgin porn gif free porn videos of milf female bodybuilder porn black big tit  https://t.co/Z43iEgC8NQ
Sat Apr 14 17:28:09 +0000 2018,ffm sex videos hot jailbait gymnasts sexteen tgp emmanuelle vaugier sexy porns biggest dick anorexic girl  https://t.co/cdVIHs1SfO
Sun Apr 15 02:28:06 +0000 2018,sexy jailbait gallery nigerian sex video sites tibetan girls sex need girls for sex i saw my sister naked  https://t.co/rAqyYbw0Md
Sat Apr 14 10:51:04 +0000 2018,ffm sex videos hot jailbait gymnasts sexteen tgp emmanuelle vaugier sexy porns biggest dick anorexic girl  https://t.co/hAZPNLvkf1
Sat Apr 14 20:08:55 +0000 2018,girl sexl free jailbait movies free teen sex in tiffin full video downloads of thick hoes getting fucked  https://t.co/fXFMC5haAG
