created_at,text
Fri Feb 02 08:15:52 +0000 2018,i love jailbait billie💓💓
Thu Feb 08 23:48:02 +0000 2018,@WHACKzander jailbait gotta stock together
Wed Feb 07 21:42:29 +0000 2018,#jailbait Girls DM and I’ll do whatever you want me to
Thu Feb 08 08:00:10 +0000 2018,any #jailbait #underage girls my age send nudes
Tue Feb 06 15:07:34 +0000 2018,Jailbait squirt https://t.co/dGMaZub7i2
Wed Feb 07 15:45:09 +0000 2018,skinnynakedgirls jailbait girlsxx https://t.co/XJ6b1LUXQV
Thu Feb 15 10:09:29 +0000 2018,teen jailbait game https://t.co/AzOWNNNhaB
Tue Feb 27 09:25:58 +0000 2018,jailbait hot naked https://t.co/N1S8Mpcm6Y
Mon Feb 05 22:18:18 +0000 2018,skinnynakedgirls jailbait girlsxx https://t.co/bRoYDQv93i
Thu Feb 22 20:12:44 +0000 2018,sexy jailbait nudes https://t.co/SodpQuHdNO
Wed Feb 07 04:49:07 +0000 2018,skinnynakedgirls jailbait girlsxx https://t.co/9KOjwhRQ0s
Fri Feb 09 11:54:31 +0000 2018,nakedsexygirlshow petite jailbait https://t.co/OIVXAaP39b
Wed Feb 07 12:10:05 +0000 2018,RT @andreyshsx: Jailbait squirt https://t.co/DWkDHPcqQM
Wed Feb 14 03:39:06 +0000 2018,jailbait girls upskirt pictures https://t.co/PbyNnD1chz
Sun Feb 11 20:23:15 +0000 2018,jailbait braless pornstars on tv https://t.co/2X6lgg5vlh
Thu Feb 15 10:12:16 +0000 2018,poland jailbait dude sexy https://t.co/2bjBnwQBsW
Thu Feb 15 10:24:24 +0000 2018,father sex daughter jailbaits https://t.co/buzP8R7a0A
Mon Feb 05 08:52:49 +0000 2018,blackgirlsongirls sexy jailbait teens https://t.co/ChWOPu5Xpi
Tue Feb 06 18:14:48 +0000 2018,tiny young jailbait video https://t.co/gjaPDHccpn
Tue Feb 06 09:14:44 +0000 2018,nude ebony jailbait girls https://t.co/DOQuiJtiBx
Wed Feb 07 02:31:11 +0000 2018,nudestarz jailbait fuck video https://t.co/Nhbwkpm9d2
Mon Feb 12 17:59:19 +0000 2018,jailbait cute hardcore scene https://t.co/rS3tonldv1
Mon Feb 12 19:11:53 +0000 2018,jailbait girls upskirt pictures https://t.co/WakNfxlKpV
Wed Feb 07 13:05:21 +0000 2018,free teen taboo jailbait in stockings https://t.co/QsYNJCWQeY
Sun Feb 11 17:57:59 +0000 2018,free pics hairy jailbait ass https://t.co/TJm7GxCdZY
Sun Feb 11 11:43:51 +0000 2018,jailbait sexy nudes whores of maroc https://t.co/TS3GdIG2MK
Sun Feb 11 21:51:53 +0000 2018,teenmegaworld com/videoporn jailbait facial https://t.co/TVLkScNieS
Mon Feb 12 02:26:13 +0000 2018,top8 porn nude jailbait vids https://t.co/siJIiSe2it
Mon Feb 12 02:59:23 +0000 2018,sexy girl picture jailbait whore https://t.co/Msbj8z2inU
Sun Feb 11 19:46:54 +0000 2018,RT @sadboyzyano: if u have a crush on me can u tell me before i date jailbait
Mon Feb 26 16:07:38 +0000 2018,naked economic jailbait nude video https://t.co/kXjgenbuS1
Thu Feb 15 09:00:36 +0000 2018,naked economic jailbait nude video https://t.co/tLDzk46XoT
Wed Feb 21 09:50:53 +0000 2018,teen models video sexy jailbait https://t.co/BT6OSaXsMA
Wed Feb 21 12:33:59 +0000 2018,sexy naked jailbait naked mpeg https://t.co/rWxlEUS25a
Thu Feb 22 05:05:43 +0000 2018,sexy naked jailbait hot body https://t.co/PNVz0tyQaQ
Thu Feb 22 02:46:29 +0000 2018,jailbait nudist netflix adult titles https://t.co/b1WRCN1qaE
Mon Feb 05 19:56:10 +0000 2018,freeblowjob porn jailbait tween models https://t.co/qFoXXTdjIz
Mon Feb 05 16:21:45 +0000 2018,jailbait sexy like porn tube https://t.co/deCvDaISoY
Fri Feb 02 02:04:15 +0000 2018,jailbait girl nudist quotes about pussy https://t.co/icZTG3xSAa
Thu Feb 22 07:35:00 +0000 2018,freepornstreams sex jailbait pics mexican https://t.co/i4H1iB31va
Tue Feb 20 01:07:55 +0000 2018,naked quiz game jailbait boy https://t.co/fdPWDu8Sx0
Wed Feb 28 08:00:23 +0000 2018,RT @CovryJessica: Rt if I can send you nudes ;)  #jailbait #dmme #nudes
Sun Feb 25 06:25:58 +0000 2018,RT @CovryJessica: Rt if I can send you nudes ;)  #jailbait #dmme #nudes
Tue Feb 06 08:44:13 +0000 2018,jailbait xxx feet muscle milf https://t.co/IhdQti0eHp
Wed Feb 07 02:25:33 +0000 2018,adult female star anal jailbait https://t.co/Nhbwkpm9d2
Mon Feb 26 03:11:48 +0000 2018,RT @CovryJessica: Rt if I can send you nudes ;)  #jailbait #dmme #nudes
Sun Feb 25 10:07:36 +0000 2018,upskirt jailbait sexy girls on nude https://t.co/AO4lZoQ5Sf
Mon Feb 12 10:06:24 +0000 2018,jailbait photo nude sexiest transsexual https://t.co/o59I7Dvx6S
Mon Feb 12 10:52:45 +0000 2018,chubby girl xxx upskirt jailbait https://t.co/O10bH1qHJY
Mon Feb 12 10:46:19 +0000 2018,jailbait nude pic ebony slave https://t.co/SL6vowLhdP
Tue Feb 13 05:45:22 +0000 2018,cocaine porn video jailbait orgys https://t.co/jn8ySjEDgg
Wed Feb 07 15:45:07 +0000 2018,grade a naked jailbait marilyn monroe porno https://t.co/oN7ANb2GPr
Tue Feb 13 17:15:39 +0000 2018,jailbait amature blonde boob fuck teen https://t.co/ODrjkNuhBx
Tue Feb 13 17:17:01 +0000 2018,jailbait sex movies british naked mom https://t.co/KarRJpqLxD
Tue Feb 13 20:33:22 +0000 2018,jailbait fuk ov guide porn videos https://t.co/eSq2QrM37f
Tue Feb 13 15:24:41 +0000 2018,jailbait pantyhose tights free tamil sex https://t.co/ABsJG8yqru
Tue Feb 13 11:16:36 +0000 2018,fantasy nude girl nude jailbait pictures https://t.co/ONUrzWlXmh
Tue Feb 13 10:24:03 +0000 2018,fucking youger girls sexy mexican jailbait https://t.co/iqMgDNkTJN
Tue Feb 13 23:55:49 +0000 2018,silk slip porn nude jailbait photo https://t.co/OEYILpCEiz
Thu Feb 08 21:04:20 +0000 2018,ash having sex sexy jailbait naked videos https://t.co/2dZ1nMccTt
Sun Feb 11 15:21:56 +0000 2018,hot jailbait porn japan sex video https://t.co/zWCyl985qa
Sun Feb 11 09:19:13 +0000 2018,new rihanna nude girls gallery jailbait https://t.co/rM1LseGpu7
Tue Feb 27 04:16:55 +0000 2018,sexy jailbait being fucked finnish naked girls https://t.co/sVeElfmrxl
Mon Feb 26 21:00:39 +0000 2018,busty jailbait hot black porn videos https://t.co/6UmhvPHDeM
Tue Feb 27 02:02:40 +0000 2018,RT @jailbaited: top 10 anime battles https://t.co/fETIpondPL
Thu Feb 15 10:50:38 +0000 2018,young naked jailbait fat woman sexs https://t.co/b8czOm0AEF
Tue Feb 27 21:13:49 +0000 2018,sexy jailbait babe teenage sexual promiscuity https://t.co/esez7dpfmO
Thu Feb 22 03:08:27 +0000 2018,teen jailbait game ebony porn 3gp https://t.co/IDSwM6Oggh
Tue Feb 06 02:50:26 +0000 2018,irish girls fucked sexy jailbait bikini https://t.co/YC5BV9KWtd
Mon Feb 05 23:25:50 +0000 2018,free female squirting clips karups jailbait https://t.co/6aTxC36WrQ
Thu Feb 01 13:12:37 +0000 2018,swinger orgy movie real jailbait nudist https://t.co/XdXdX7S57D
Fri Feb 02 06:04:33 +0000 2018,wet sex porn jailbait girls kissing https://t.co/IJ9mQs0xHR
Thu Feb 01 16:51:20 +0000 2018,girls with dildos and vibrators jailbait slumber party https://t.co/TTwADpb503
Mon Feb 19 17:05:34 +0000 2018,sexy women masterbateing completely nude jailbait https://t.co/w85fNMmji8
Mon Feb 19 16:18:46 +0000 2018,sexy teens working out real jailbait tgp https://t.co/0dBAs2ahaa
Sun Feb 25 00:29:07 +0000 2018,nude jailbait streaming massage room sex https://t.co/2UheJCHddJ
Sun Feb 25 02:43:26 +0000 2018,@LaurenJauregui I fuckin stan jailbait billie to the ENDDDD keep our girl on the down low lauren
Tue Feb 06 14:24:25 +0000 2018,amateur females masturbating barely legal jailbait https://t.co/vbIWT9S9lV
Tue Feb 06 15:08:34 +0000 2018,jailbait porn girls young chubby sex https://t.co/ZfNH7fM1hq
Tue Feb 06 18:55:59 +0000 2018,jailbait nude fuck videos fucking good https://t.co/SuMmWLFouo
Wed Feb 07 05:31:16 +0000 2018,sexy women masterbateing completely nude jailbait https://t.co/sAtC6kfriu
Sun Feb 25 21:28:51 +0000 2018,free jailbait girl galleries porntube passwords https://t.co/H1K4dgtaBo
Mon Feb 12 09:30:55 +0000 2018,naked jailbait pictures porno sexy costume https://t.co/fvnZcHZ0yL
Mon Feb 12 08:26:45 +0000 2018,girlxxx jailbait naked nerdy girl gif https://t.co/E7tARsXQzU
Tue Feb 13 06:07:01 +0000 2018,which porn star has the biggest penis jailbait nude https://t.co/PcGGapHpEP
Tue Feb 13 06:04:56 +0000 2018,jailbait naked pics uk grandmother porn https://t.co/PO5vZZsuWz
Tue Feb 13 06:59:58 +0000 2018,jailbait girls sex porn with old woman https://t.co/QB0FoQYjlz
Mon Feb 12 23:05:29 +0000 2018,nude jailbait galleries caught nude on beach https://t.co/xZsXYKorqF
Fri Feb 23 10:15:15 +0000 2018,petite jailbait straight men having sex with men https://t.co/BSYm5KiS9Z
Wed Feb 07 14:30:33 +0000 2018,naked jailbait video men fucks german sherpard https://t.co/0oHuzk2OkR
Thu Feb 08 03:36:46 +0000 2018,college free sex jailbait real nude porn https://t.co/CUZTMXF50f
Wed Feb 07 12:24:30 +0000 2018,jailbait sexy vid clips english teen sex https://t.co/iZZZCF6wS1
Tue Feb 13 14:16:10 +0000 2018,hot nude jailbait teen naked on boat gallery https://t.co/qGD9QErRNb
Tue Feb 13 20:40:02 +0000 2018,japanese wild sex scenes jailbait braless pics https://t.co/wDvAQxas4W
Tue Feb 13 20:34:13 +0000 2018,RT @youngcourttv: y’all be jailbait like mf 😐 https://t.co/OHjI0t2LS4
Wed Feb 14 01:37:40 +0000 2018,RT @youngcourttv: y’all be jailbait like mf 😐 https://t.co/OHjI0t2LS4
Tue Feb 13 22:00:49 +0000 2018,RT @youngcourttv: y’all be jailbait like mf 😐 https://t.co/OHjI0t2LS4
Wed Feb 14 04:04:53 +0000 2018,girl jailbait nude nude girls images portal https://t.co/TdUFmvynk2
Tue Feb 13 12:43:42 +0000 2018,porn on the bus jailbait teens naked in alabama com https://t.co/TcZQFEkgMm
Tue Feb 13 21:52:48 +0000 2018,porno severina nude teen jailbait sex hot https://t.co/Ts558mvryW
Tue Feb 13 19:38:36 +0000 2018,comic sex strips naked jailbait next door https://t.co/W8sxjIAVCy
Thu Feb 08 08:17:32 +0000 2018,mercedes masohn nude porn naked young jailbait https://t.co/8vMkqVkX9e
Sun Feb 11 22:22:30 +0000 2018,female muscle porn pics sexy emo jailbait https://t.co/DlTkqPsKwc
Mon Feb 12 00:19:34 +0000 2018,is anal sex nasty naked jailbait teens video https://t.co/JEvQQYInbj
Mon Feb 12 04:36:23 +0000 2018,teen jailbait sleep porn big but anal sex https://t.co/6jgvzrb9pO
Thu Feb 15 14:30:57 +0000 2018,angelina valentine anal video jailbaits girls peachez https://t.co/of5LCQvJqJ
Thu Feb 15 11:17:47 +0000 2018,sexy jailbait gallery nigerian sex video sites https://t.co/KGxozHposq
Thu Feb 15 13:49:33 +0000 2018,free nude sleeping pics sleep daughter jailbait https://t.co/cXOIuECi6s
Fri Feb 02 10:24:58 +0000 2018,jailbait teen nude free flash porn downloads https://t.co/nVcwyS2OmJ
Fri Feb 02 23:52:57 +0000 2018,men fuck women in jungle naked jailbait videos https://t.co/XmCI1BhA0b
Thu Feb 22 02:23:03 +0000 2018,cameron diaz porn movies images teen jailbait https://t.co/4bP0E8W3Ei
Mon Feb 05 17:38:15 +0000 2018,www jailbait only com cartoon network toon porn https://t.co/GpJsqM2ku5
Mon Feb 05 15:32:10 +0000 2018,junior high jailbait clips imajenes animadas porno https://t.co/soIdc0yhLX
Tue Feb 06 04:30:31 +0000 2018,jailbait girls candid teen funs pics only free https://t.co/qSmzJHeWBW
Mon Feb 05 19:24:07 +0000 2018,super sexy scene jailbait girls nude fuck https://t.co/0BLClYEzJT
Thu Feb 22 14:04:16 +0000 2018,anal sex big butt teen sex jailbait https://t.co/hSh0FEWTe9
Thu Feb 22 10:48:02 +0000 2018,nude jailbait thread 18 only girls pics blogspot https://t.co/Gk3RDIMBSV
Mon Feb 19 22:13:59 +0000 2018,free teen porndown loads bravo teen jailbait https://t.co/prOd8Qdchm
Sat Feb 24 12:29:41 +0000 2018,jailbait girls naked strip asian anal sluts https://t.co/UhAiKL0Vj9
Tue Feb 06 17:40:48 +0000 2018,free videos lesbians sex nude jailbait porn https://t.co/T3XrZs0ThJ
Tue Feb 06 14:03:19 +0000 2018,jailbait girls kissing drunk girl fucked party https://t.co/3zuikaNB0J
Tue Feb 06 11:47:00 +0000 2018,free teen porndown loads bravo teen jailbait https://t.co/XhrRMobZ6M
Tue Feb 06 07:32:50 +0000 2018,nude jailbait teens on beach sexy girls triathlete https://t.co/YyeiHybhQb
Tue Feb 06 16:11:11 +0000 2018,burmese nude pics jailbait first time penis https://t.co/nDcvp54aVY
Tue Feb 06 16:35:42 +0000 2018,photo naked teen jailbait shower porn torrent https://t.co/JscqBUgI6C
Sun Feb 25 16:02:01 +0000 2018,Looking to #cumtribute hit my dms with pics girls only #cumtribute #nude #teen #jailbait #cocktributre
Tue Feb 13 01:56:21 +0000 2018,sexy jailbait fucked hard 14girl have sex pics https://t.co/OUYVtDNiug
Tue Feb 13 03:35:35 +0000 2018,sexy jailbait fucked hard 14girl have sex pics https://t.co/aGB5nWLaDt
Mon Feb 12 09:59:20 +0000 2018,jailbait anal pictures sandee westgate nude pictures https://t.co/ckrjwSJa4l
Mon Feb 12 09:02:01 +0000 2018,nude jailbait teens pics pleasure without sex https://t.co/m8UXeRc1Bt
Mon Feb 12 21:05:10 +0000 2018,gallery pussy teen xxx non nude jailbaits https://t.co/IfhpfMm8Fw
Mon Feb 12 10:08:21 +0000 2018,married women porno free teen jailbait forum https://t.co/pOeVdjYsU6
Mon Feb 12 10:29:36 +0000 2018,jailbait teen sister fucks brother girls uniform https://t.co/wfGrUclNUD
Fri Feb 23 08:10:26 +0000 2018,sex kraz d superstars real jailbait pics https://t.co/pM0rNd7k6N
Fri Feb 23 23:24:31 +0000 2018,"May or may not make an audio~ should I?
#jailbait #hornyteen #teenslut #cumslut #ddlg #mdlg #cumtributeِ"
Fri Feb 09 12:37:31 +0000 2018,image sexy girl and brother jailbait booties shorts https://t.co/CjIfNxG5QX
Wed Feb 07 11:54:27 +0000 2018,moms teach teens to fuck jailbait girl fucking with man https://t.co/duJyPiorq6
Wed Feb 14 01:03:12 +0000 2018,young jailbait nude honestly why haven t we had sex yet https://t.co/ZPpOGx59Hm
Tue Feb 13 21:03:14 +0000 2018,perfect teen fucked hard free naked sexy jailbait https://t.co/VA5pc7WWVt
Mon Feb 12 00:12:57 +0000 2018,hot teen jailbait fucked hardcore xxx sex movies https://t.co/F5U7NzL2xA
Sun Feb 11 21:53:13 +0000 2018,new hindi sex story free jailbait girl galleries https://t.co/MTYEgNz8Yc
Fri Feb 02 08:15:55 +0000 2018,jailbait teen sexy porno video brasilian porn stars https://t.co/AeTnKVaqGZ
Fri Feb 02 19:52:54 +0000 2018,@TheCyberPunk17 @whitegirlmcnugg be honest i think he going to make it in to his own jailbait server https://t.co/bW9TL27Wpv
Mon Feb 05 15:35:16 +0000 2018,naked young jailbait free full black porn video https://t.co/BHhJGzMmh9
Mon Feb 05 22:17:01 +0000 2018,sexy naked girls jailbait nude body painting pics https://t.co/rYo5SOTUE2
Tue Feb 06 06:15:02 +0000 2018,a girl and a boy haveing sex naked jailbait nude forum https://t.co/Z4EOPxdd2h
Fri Feb 02 00:59:42 +0000 2018,pics of nude bihari women jailbait teens pics nude https://t.co/pdcuiA0QO8
Tue Feb 20 02:22:48 +0000 2018,RT @jailbait_tiff: Right or left? #cumtribute #cumslut #jailbait #jailbaitslut https://t.co/PeBtEmAFc5
Sun Feb 25 01:03:45 +0000 2018,jailbait girls porno pics ex girlfriend revenge nude https://t.co/1abFtPrYxB
Sun Feb 25 06:57:51 +0000 2018,RT @Amberteenslut: What’s not to love #horny #jailbait #DaddyDaughter #bigcock https://t.co/lceAk7KM71
Wed Feb 07 01:38:27 +0000 2018,adult games funny games teen jailbait sex pics https://t.co/dkIZw1QORD
Tue Feb 06 09:51:13 +0000 2018,sexual tips for teens free nude sexy jailbait pics https://t.co/erZq7yWY6X
Mon Feb 12 14:52:41 +0000 2018,jailbait anal pics free nude pictures of carmen electra https://t.co/augwImd5Yn
Mon Feb 12 08:52:29 +0000 2018,sexy girls video smoking tube 16yr old jailbait https://t.co/VxnOqGyQoL
Tue Feb 13 05:54:10 +0000 2018,naked very small girls jailbait girls naked seductive blogs https://t.co/3THdQGHpNm
Fri Feb 09 12:13:37 +0000 2018,RT @billieeilish: my name not billie eilish no more its jailbait billie fuck billie eilish dont call me that
Tue Feb 13 10:15:06 +0000 2018,sexy girls jailbait naked forum pierced sexy girls faucet https://t.co/hB8IFf6ttw
Tue Feb 13 07:55:09 +0000 2018,puerto rican girls fucking black guys jailbait girls being fucked https://t.co/GPzXiFs2vB
Thu Feb 08 14:04:34 +0000 2018,tory lane free porn videos peteen jailbait nude pics https://t.co/7OmarK0EXb
Thu Feb 08 15:46:05 +0000 2018,sexy girls in one piece swimsuits hot naked jailbait sex https://t.co/9KOI9dG9AW
Thu Feb 08 16:08:35 +0000 2018,RT @jailbait_tiff: Retweet if you love this ass #cumtribute #cumslut #jailbait #jailbaitslut https://t.co/11G29l5Ads
Sun Feb 11 14:50:18 +0000 2018,can you have unprotected sex after taking plan b teen jailbait stories https://t.co/O5kjdbPx2C
Mon Feb 12 06:33:44 +0000 2018,free pics of jailbait girls free videos of nude solo woman https://t.co/tPDX3zXEE3
Thu Feb 15 18:03:53 +0000 2018,RT @jailbait_tiff: Retweet if you love my smile #cumtribute #cumslut #jailbait #jailbaitslut https://t.co/OQLs48HP1c
Thu Feb 15 21:29:10 +0000 2018,RT @jailbait_tiff: Retweet if I’m sexy #cumtribute #cumslut #jailbait #jailbaitslut https://t.co/61HomcY25P
Fri Feb 02 17:46:06 +0000 2018,old lady having sex video free naked young jailbait cam https://t.co/RnxamPu0gB
Fri Feb 02 14:06:58 +0000 2018,hot girl on girl porn movies jailbait nude sexy teen https://t.co/2VA0Y2AB8C
Fri Feb 02 11:13:14 +0000 2018,naked models on top of each other blog jailbait stickam webcam porn blog https://t.co/MAG1RGW0Z1
Mon Feb 05 14:22:25 +0000 2018,pic of naked free sex iranian women jailbait babe pics https://t.co/7XlW8RdPqK
Mon Feb 05 22:40:19 +0000 2018,free adult breastfeeding videos anal sex jailbait teen buttfuck https://t.co/soIdc0yhLX
Tue Feb 06 06:25:56 +0000 2018,jailbait girls foot fucking my best friends girl fuck that pussy https://t.co/DFNBbvHNwX
Sun Feb 25 05:44:32 +0000 2018,RT @jailbait_tiff: Retweet if you love my smile #cumtribute #cumslut #jailbait #jailbaitslut https://t.co/OQLs48HP1c
Sun Feb 25 14:06:06 +0000 2018,RT @nerdyjohn1417: Love these girls! #young #teen #jailbait #bikiniteens #cumtribute https://t.co/I5eYTF6do5
Mon Feb 12 15:20:33 +0000 2018,jailbait naked sandra police fucking the innocent girl video sites https://t.co/BYKpInXRj3
Mon Feb 12 12:17:00 +0000 2018,pole dancing naked girls nude pics of real jailbait girls https://t.co/8PTe4rI1Xz
Tue Feb 13 22:31:28 +0000 2018,RT @jailbait_tiff: Retweet if you love my little tits #cumtribute #cumslut #jailbait #jailbaitslut https://t.co/EUFkenEaxe
Tue Feb 13 10:40:56 +0000 2018,images pictures photos partty fuking analsgirls forum jailbait nude hd https://t.co/Ojs8wuZ0no
Sun Feb 11 08:17:06 +0000 2018,girls next door xxx free clips of naked jailbait anime girl https://t.co/SxG4xlIL4s
Thu Feb 15 09:05:08 +0000 2018,RT @jailbait_tiff: Retweet if you’d fuck me and my sis #cumtribute #cumslut #jailbait #jailbaitslut https://t.co/r200UaTKbH
Mon Feb 05 19:25:18 +0000 2018,"@shoe0nhead 
E X T R A  T H I N N 14 year old jailbait ""comedian"""
Sat Feb 24 14:36:54 +0000 2018,RT @jailbait_tiff: Retweet if you’d fuck me and my sis #cumtribute #cumslut #jailbait #jailbaitslut https://t.co/r200UaTKbH
Wed Feb 07 06:26:38 +0000 2018,RT @jailbait_tiff: Retweet if you wish I were sitting on your cock #cumtribute #cumslut #jailbait #jailbaitslut https://t.co/xM5T3aSUrs
Tue Feb 06 23:26:34 +0000 2018,free clips of naked jailbait anime girl free nasty ebony porn https://t.co/Vyq1PRTleM
Sun Feb 25 21:19:36 +0000 2018,RT @jailbait_tiff: Retweet if you wish I were sitting on your cock #cumtribute #cumslut #jailbait #jailbaitslut https://t.co/xM5T3aSUrs
Sun Feb 25 23:12:17 +0000 2018,RT @stacymtell3: why do men keep looking down my shirt daddy? #cumslut #cumtribute #jailbait https://t.co/dz8KkTYbYb
Fri Feb 23 07:40:43 +0000 2018,"Extremely horny rn, DM me for a chat
#horny #hornydm #teen #teendick #teencock #hornyteen #jailbait #underage #milf"
Fri Feb 16 22:06:12 +0000 2018,RT @jailbait_tiff: Retweet if you’d come fuck me cumtribute #cumslut #jailbait #jailbaitslut https://t.co/bmVEtvvHHT
Fri Feb 09 22:57:04 +0000 2018,"RT @thatsluttykitty: My old account was removed, but I'm back. Come entertain your princess? 
#jailbait #teenslut #cumslut #virginslut #ddl…"
Wed Feb 07 08:29:23 +0000 2018,jailbait teens sleeping pics oops carrie ann inaba girlie show nude https://t.co/79YUlpZMyc
Tue Feb 13 11:07:26 +0000 2018,black teen jailbait african police men fucking police women in fucking videos https://t.co/vYrIqmdiUR
Wed Feb 14 04:03:11 +0000 2018,RT @black_cumwhores: Throatfuck me #cum #deepthroat #teen #throatfuck #cumtribute #cumslut #jailbaitslut #jailbait https://t.co/oNQ9hbcOZn
Thu Feb 08 10:11:09 +0000 2018,RT @germanslut337: Rate this  slut out of 10. #tits #ass #cumtribute #cumslut #cockslut #cocktribute #slut #cumwhore #jailbait #jailbaitslu…
Sun Feb 11 10:44:19 +0000 2018,RT @germanslut337: Retweet for more boys💕 #tits #ass #cumtribute #cumslut #cockslut #cocktribute #slut #cumwhore #jailbait #jailbaitslut ht…
Sun Feb 11 23:56:54 +0000 2018,RT @lots_of_gurls: Girls like this make me wet 😍 #jailbait #teensluts #horny #sexyteens https://t.co/stp5ZUcvni
Wed Feb 28 03:12:12 +0000 2018,RT @millie_xox_16: Do you want me ? RT this and follow me for a DM #bodyposi #jailbait #teen #isendnudes #followme https://t.co/nqo1HWQIgO
Tue Feb 27 21:28:08 +0000 2018,RT @jailbait_tiff: Retweet if you’d slap my face with your cock #cumtribute #cumslut #jailbait #jailbaitslut https://t.co/qQqRjHzje7
Fri Feb 23 04:41:26 +0000 2018,RT @BelgardNicole: RT if you'd fuck me! Sending nudes to one lucky retweeter! #giveaway #jailbait #cocktribute #nudes #cumtribute #fuckme #…
Fri Feb 23 02:22:05 +0000 2018,RT @germanslut337: Rate this  slut out of 10. #tits #ass #cumtribute #cumslut #cockslut #cocktribute #slut #cumwhore #jailbait #jailbaitslu…
Mon Feb 19 18:18:27 +0000 2018,RT @jailbait_tiff: Retweet if you love my ass in my tight dress #cumtribute #cumslut #jailbait #jailbaitslut https://t.co/R1loexBonU
Wed Feb 28 18:25:24 +0000 2018,RT @Sexy_Emilee: Me and my friend @Sexy_Tegan love to make out! Can we get some RETWEETS?😜💕😈 #cumtribute #horny #fuckme #jailbait #underage…
Tue Feb 06 17:04:30 +0000 2018,RT @cumslutMilena: Rate this  slut out of 10. #tits #ass #cumtribute #cumslut #cockslut #cocktribute #slut #cumwhore #jailbait #jailbaitslu…
Tue Feb 06 19:15:48 +0000 2018,"RT @DailyTeenSluts: Little treat for y'all, RT and LIKE and I will send a pussy pic to some of you #jailbait #cumtribute #cocktribute #slut…"
Mon Feb 26 05:00:26 +0000 2018,jap teen sex movie car jailbait girlfriend homemade close up youtube com https://t.co/EORk0Z1tyA
Mon Feb 12 23:07:46 +0000 2018,RT @jailbait_tiff: Retweet if you love my ass in my tight dress #cumtribute #cumslut #jailbait #jailbaitslut https://t.co/R1loexBonU
Fri Feb 23 12:23:32 +0000 2018,RT @germanslut337: Rate this  slut out of 10. #tits #ass #cumtribute #cumslut #cockslut #cocktribute #slut #cumwhore #jailbait #jailbaitslu…
Fri Feb 23 19:57:27 +0000 2018,@analisamarie_ Let me know how it works. Saying you’re jailbait doesn’t work either. Some men like them young 🤢🤮
Fri Feb 23 16:00:13 +0000 2018,RT @germanslut337: Rate this  slut out of 10. #tits #ass #cumtribute #cumslut #cockslut #cocktribute #slut #cumwhore #jailbait #jailbaitslu…
Fri Feb 16 22:13:59 +0000 2018,"RT @bowenroad: jonatan leandoer, jailbait billie, cash carti

(pencil, coffee, ink) https://t.co/VYmKzzhfYy"
Sat Feb 10 05:42:16 +0000 2018,RT @thatguy201318: Sometimes leaving the clothes on is better. Let’s the imagination do the work for these #jailbait https://t.co/Vs0JQjC3qk
Sat Feb 10 02:29:05 +0000 2018,RT @Cumwatcher14: RT this if u want to cumtribute me. I'll dm u a pic to do. Lines don't count! #teen #jailbait #cum #cumtribute
Tue Feb 13 23:55:11 +0000 2018,Any ladies white ladies want to dominate my 18 yr old black ass? Make me crawl and beg to cum #jailbait #cumtribute
Sun Feb 11 22:50:59 +0000 2018,RT @germanslut337: Retweet if You want to fuck me  💕 #tits #ass #cumtribute #cumslut #cockslut #cocktribute #slut #cumwhore #jailbait #jail…
Sun Feb 11 11:09:32 +0000 2018,RT @germanslut337: Retweet if You want to fuck me  💕 #tits #ass #cumtribute #cumslut #cockslut #cocktribute #slut #cumwhore #jailbait #jail…
Mon Feb 26 22:08:53 +0000 2018,RT @Morgann_babe: Retweet if you love my little tits #tits #ass #cumtribute #cumslut #cockslut #cocktribute #slut #cumwhore #jailbait #jail…
Tue Feb 27 06:22:17 +0000 2018,"RT @LauraTributes: RT and follow for a chance to get a follow back ♥️ #cocktribute #cumtribute #teen #jailbait #legs 

Only replying to cum…"
Fri Feb 16 05:10:37 +0000 2018,RT @germanslut337: Retweet if You want to fuck me  💕 #tits #ass #cumtribute #cumslut #cockslut #cocktribute #slut #cumwhore #jailbait #jail…
Tue Feb 06 05:37:26 +0000 2018,"RT @Cumslut706_2: Someone cum over me while im in school please 😊
#school #cocktribute #cumtribute #cumslut #wanktribute #slut #jailbait ht…"
Thu Feb 22 19:29:26 +0000 2018,RT @centaurmediainc: NEW RELEASE: DADDY's JAILBAIT https://t.co/7O7WsGYb3H @WillAngellXXX @pupbadgerxxx #bareback #dadandson #daddysboy #bo…
Tue Feb 20 01:45:44 +0000 2018,RT @Judy__Ventura: How To Prevent Premature Ejaculation #sexoengrupo #hd #granpolla #morena #milf #jailbaits #moan #ass #tits #bitch #teens…
Wed Feb 28 21:46:50 +0000 2018,RT @submissiveskye1: Wanna see more? Purchase my premium 😏😘 #young #jailbait #teen #nude #nudity #topless #hotgirls #alternativegirl #amatu…
Wed Feb 07 01:52:52 +0000 2018,RT @Morgan_jailbait: Retweet if you love my lil bootyy #tits #ass #cumtribute #cumslut #cockslut #cocktribute #slut #cumwhore #jailbait #ja…
Tue Feb 06 12:50:26 +0000 2018,RT @AshleyMama69: Does anyone know where I can find some naughty high school girls on here? PLEASE #DM me!!! #Teen #Jailbait #Horny as #fuck
Mon Feb 12 19:31:56 +0000 2018,RT @germanslut337: Retweet if You want to fuck me  💕 #tits #ass #cumtribute #cumslut #cockslut #cocktribute #slut #cumwhore #jailbait #jail…
Sat Feb 24 03:39:22 +0000 2018,RT @Morgann_babe: Retweet if I’m sexy #tits #ass #cumtribute #cumslut #cockslut #cocktribute #slut #cumwhore #jailbait #jailbaitslut https:…
Fri Feb 23 21:56:37 +0000 2018,RT @asianCumslutx: Looking for someone to shoot a fat dirty load on my face #cumslut #cumtribute #jailbait #teenslut #dicktribute https://t…
Fri Feb 23 10:24:24 +0000 2018,RT @Morgann_babe: Retweet if you’d cum all over my face #tits #ass #cumtribute #cumslut #cockslut #cocktribute #slut #cumwhore #jailbait #j…
