created_at,text
Tue Dec 19 20:44:28 +0000 2017,Will anyone tribute my jailbait friend please? Dm me #cocktribute #cumtribute #jailbait
Thu Dec 07 09:43:39 +0000 2017,"@kevinabuckland2 
Do you want to see my 
Jailbait sister"
Sun Dec 31 10:40:30 +0000 2017,@HealthandHubris prime jailbait is the holy grail
Sat Dec 23 07:11:23 +0000 2017,Some #jailbait to motivate you https://t.co/gJRcBF4zUt
Thu Dec 07 09:22:13 +0000 2017,real jailbait nudes  https://t.co/sDQ5VPCWrM
Wed Dec 13 16:59:18 +0000 2017,jailbait hot naked https://t.co/xOZ21eiaiA
Fri Dec 15 16:01:11 +0000 2017,hardcore jailbait portals https://t.co/NBFgrcbygT
Thu Dec 14 22:07:42 +0000 2017,jailbait sexting pic https://t.co/64i6GNVmIz
Thu Dec 14 19:59:21 +0000 2017,jailbait girl pictures  https://t.co/vQKVdqEJ2j
Thu Dec 14 23:20:22 +0000 2017,prom jailbait pics https://t.co/do6UwAzfqZ
Mon Dec 25 17:08:04 +0000 2017,@nesuness @flightlessnico shes trying to jailbait you dont do it king
Sun Dec 10 12:49:25 +0000 2017,stolen jailbait nude pics https://t.co/VbE5BL91GN
Sun Dec 10 10:17:02 +0000 2017,real jailbait ass pics https://t.co/UdSSmsp68j
Sun Dec 10 10:17:02 +0000 2017,real jailbait ass pics https://t.co/UdSSmsp68j
Fri Dec 08 04:43:18 +0000 2017,Highly recommend watching Jailbait on Netflix... movie is fucking insane
Mon Dec 11 09:57:50 +0000 2017,jailbait sex facking sexy https://t.co/qHa96fJXlH
Mon Dec 11 19:07:31 +0000 2017,huge pussy jailbait gallery https://t.co/wmTanHQm5d
Tue Dec 26 18:29:21 +0000 2017,RT @skiller1010: Before and after #teen #jailbait https://t.co/jtMgwhxlEW
Wed Dec 27 07:22:04 +0000 2017,jailbait posters ipod sex https://t.co/fyLwqY8Mzh
Wed Dec 06 04:52:22 +0000 2017,"""I need a jailbait gf uwu"" https://t.co/dwt21TzY9X"
Fri Dec 01 22:00:06 +0000 2017,king naked jailbait posters https://t.co/xMh7B8PHAg
Sat Dec 23 05:28:08 +0000 2017,Anyone want to video #cumtribute a #jailbait slut? DM me if interested
Mon Dec 25 12:47:23 +0000 2017,nude sexy jailbait models https://t.co/YhrQvFaRyf
Sun Dec 10 22:53:20 +0000 2017,hardcore jailbait movie review porn https://t.co/yjJ9VreupQ
Mon Dec 11 03:33:31 +0000 2017,jailbait photo nude sexiest transsexual https://t.co/88GOdynxMe
Sun Dec 10 07:38:10 +0000 2017,jailbait caught naked pussy blonds https://t.co/EjeSpJl6G5
Mon Dec 11 14:00:05 +0000 2017,blowjob compilation jailbait getting fucked https://t.co/HZEX3jKmcp
Mon Dec 11 09:00:49 +0000 2017,gaging blowjobs hot naked jailbaits https://t.co/juYNONoBtB
Tue Dec 26 12:56:51 +0000 2017,movis porno free soft jailbait https://t.co/Y9W2Abw7Nd
Fri Dec 15 14:53:37 +0000 2017,nude erotic jailbait boy galleries https://t.co/9hNvI7fKSX
Mon Dec 18 03:37:03 +0000 2017,tv porns jailbait pageant nudist https://t.co/kE3yhcr2fA
Mon Dec 18 02:07:41 +0000 2017,freepornstreams sex jailbait pics mexican https://t.co/z8k2VsZsfe
Sat Dec 02 12:53:10 +0000 2017,jailbait sexy like porn tube https://t.co/bex2YWwjJb
Sat Dec 30 06:20:57 +0000 2017,jailbait girl sexey girls in short https://t.co/sNS15q3V2W
Fri Dec 29 16:32:08 +0000 2017,teensexfreepictures free teen video jailbait https://t.co/jBFSbIOD2N
Wed Dec 27 22:03:22 +0000 2017,jailbait sleeping porn www teeniepornpics https://t.co/dx7qP4HLe0
Thu Dec 14 20:23:15 +0000 2017,jailbait girl nude pictures teenbabesvideo https://t.co/zmqickoeSC
Sun Dec 03 10:23:50 +0000 2017,jailbaits girls peachez productions porn https://t.co/G5fYFCvRPU
Sun Dec 03 23:23:20 +0000 2017,upskirt jailbait sexy girls on nude https://t.co/xcgfJtepiN
Fri Dec 01 21:26:43 +0000 2017,sexfreethailand best naked jailbait gallery https://t.co/jTyqrniIbA
Sun Dec 31 00:15:40 +0000 2017,I'm a jailbait gf not cause I'm underage but because I'll call you a rapist and have your entire life ruined
Sat Dec 30 21:17:18 +0000 2017,dadsex porn jailbait teens naked https://t.co/D9YiN4hHog
Sat Dec 30 23:29:42 +0000 2017,jailbait teenie porn clips 89 https://t.co/hoAavijZCV
Sat Dec 30 23:24:53 +0000 2017,jailbait-girl boy sexy lesbi https://t.co/ROzD0lZ2wT
Sat Dec 23 02:03:46 +0000 2017,jailbait sexy nudes whores of maroc https://t.co/yex65Wc5TC
Wed Dec 13 03:52:35 +0000 2017,female jailbait fantasy porn site https://t.co/F11SkpLA6j
Sun Dec 24 03:42:31 +0000 2017,jailbait sexy nudes whores of maroc https://t.co/H5YxyXZkDD
Sun Dec 10 11:57:58 +0000 2017,techno jailbait nude sister in the hood porn https://t.co/diUgYXI9Zf
Sun Dec 10 16:38:12 +0000 2017,sexygirlsget fucked pics school uniform jailbait https://t.co/rbq7gWCV0R
Wed Dec 13 15:45:24 +0000 2017,nude shridevi jailbait naked girl free https://t.co/M5IYplF9WJ
Thu Dec 14 00:12:33 +0000 2017,jailbait feet car wash video naked https://t.co/fMvQTqVwih
Thu Dec 14 02:41:33 +0000 2017,aurora snow pornstar jailbait girl youtube https://t.co/iecpCLR3L0
Thu Dec 14 06:14:50 +0000 2017,teen jailbait stories nude satanists girls https://t.co/UZ7mofpBbW
Fri Dec 08 13:53:45 +0000 2017,nude jailbait torrents bobby clark porn https://t.co/CGRVGstVwg
Tue Dec 26 09:25:29 +0000 2017,RT @skiller1010: Tits or ass? #teen #jailbait https://t.co/ukE6AL9z3C
Tue Dec 26 11:58:56 +0000 2017,real jailbait pussy very young hot pussy https://t.co/oJIyhrACrx
Fri Dec 15 09:29:55 +0000 2017,ukrainian nude pics jailbait sex girl https://t.co/olIsYVTsog
Sat Dec 16 02:00:54 +0000 2017,What hot #jailbait #underage #preteen she makes me so horny https://t.co/Fl3cw0WN0O
Fri Dec 15 07:26:55 +0000 2017,jailbait amature blonde boob fuck teen https://t.co/xkWlvmt89x
Sun Dec 03 02:13:55 +0000 2017,amateur football alliance jailbait girls xxx https://t.co/zD9JuTGzIH
Sat Dec 02 07:56:14 +0000 2017,cybersex game 3d jailbait panty pics https://t.co/6PTjY0wkSO
Tue Dec 05 01:17:19 +0000 2017,naked jailbait teens your free porn video https://t.co/biz7gWGt1m
Wed Dec 27 11:03:22 +0000 2017,jailbait daughter girl with glasses reality porn https://t.co/bIQicFgTHw
Wed Dec 06 00:24:49 +0000 2017,quality porn clips hot jailbait naked https://t.co/F3lB2hmqgA
Thu Dec 14 20:01:11 +0000 2017,nudeteen movies real black jailbait teen https://t.co/Ha1ekwkLzb
Thu Dec 14 18:11:27 +0000 2017,jailbait naked pics uk grandmother porn https://t.co/9v0js9mCIq
Mon Dec 04 03:52:30 +0000 2017,porn hd vids sexy jailbait girl https://t.co/xRerQAVgui
Sun Dec 03 12:09:36 +0000 2017,jailbait photos sex video of phone sex https://t.co/lUG5y5VkMj
Mon Dec 04 05:49:57 +0000 2017,jailbait porn movies charlize theron sexy https://t.co/Dr7eUF3ZUd
Sat Dec 02 01:26:16 +0000 2017,anal 3gp naked jailbait teen videos https://t.co/fBPSLXDykW
Fri Dec 01 21:14:34 +0000 2017,porno jailbait girls hairy pussy naked https://t.co/gNt3ZgkGbE
Sun Dec 24 18:03:14 +0000 2017,porn lick pussy young jailbait nude https://t.co/KSIXOycOYS
Wed Dec 06 14:53:57 +0000 2017,classroom of girl naked jailbait bikini vids https://t.co/3UHddfFf70
Tue Dec 26 02:41:40 +0000 2017,malaysian girl nude teen jailbait nude https://t.co/GNcOi3keO7
Sun Dec 24 05:09:05 +0000 2017,rebecca love naked obese jailbait pics https://t.co/JfaUi3nsvD
Sun Dec 10 00:09:06 +0000 2017,jailbait art nud group sex milf https://t.co/vMF4ce9mhz
Sun Dec 10 04:57:37 +0000 2017,80's pornstars jailbait girls porno pics https://t.co/jePPzqVOEM
Sun Dec 10 16:36:17 +0000 2017,azerbaijan sexy girls xxx jailbait babes pictures https://t.co/28uy8jFtD7
Sun Dec 10 16:40:30 +0000 2017,hardcore jailbait portals hottest filipina porn star https://t.co/Vx0NypQr35
Thu Dec 07 09:00:57 +0000 2017,linda darnell nude authentic nude jailbait pics https://t.co/8rS8xjHsMZ
Thu Dec 07 08:04:59 +0000 2017,nude real jailbait teen sexwality free sex https://t.co/j5RwGNzRH0
Fri Dec 08 05:34:26 +0000 2017,normal looking nude people jailbait girl stripping https://t.co/HjcZceiUkt
Wed Dec 13 20:03:01 +0000 2017,girls gettingfuck videos pussy young jailbait forum https://t.co/Vhk1VNrcvI
Wed Dec 13 18:43:02 +0000 2017,hot jailbait nude live sex cam chat https://t.co/P73fqIA0z9
Tue Dec 19 02:38:36 +0000 2017,sleep daughter jailbait planet katie pussy pics https://t.co/28k3kU6iGC
Mon Dec 11 08:05:04 +0000 2017,sex pic petite girl hot naked jailbait https://t.co/CWqRwP8EaY
Mon Dec 11 13:08:33 +0000 2017,six men on one teen jailbait lesbian seduction https://t.co/4XnjriECp9
Mon Dec 11 07:00:04 +0000 2017,black and latina jailbait pictures nude girls in video https://t.co/ZrF8qzwdke
Tue Dec 26 18:09:15 +0000 2017,jailbait sex pic older women fucking boy https://t.co/vWogZ8Hm7q
Sat Dec 16 01:08:20 +0000 2017,jailbait girls masterbaiting free pics metart pussy https://t.co/rE15Dy3Mlo
Sun Dec 17 14:36:02 +0000 2017,#NP Live: Aerosmith - Jailbait - Now @ https://t.co/qinNCgs5SD #NowPlaying #Music
Sun Dec 17 19:54:07 +0000 2017,nude wifey xxx tiny teen jailbait pics https://t.co/7qRZbmsDlg
Sun Dec 17 16:12:42 +0000 2017,@SommerSeraph im just surprised u showed this to ur friends the jailbait is old news
Sat Dec 30 01:50:54 +0000 2017,surf girl jailbait tease health benefits sex https://t.co/AiwaVVJ7MS
Fri Dec 29 19:19:34 +0000 2017,brutal anal sex pictures jailbait teens nude https://t.co/wYa1mQevLX
Thu Dec 28 00:09:54 +0000 2017,sexy small penis jailbait girl sex videos https://t.co/UPq0JtRgG9
Tue Dec 05 11:05:12 +0000 2017,young jailbait porn young adult realistic fiction https://t.co/cTNsXJ4YT9
Thu Dec 14 20:08:05 +0000 2017,photo naked teen jailbait shower porn torrent https://t.co/6XmlhOFGsl
Thu Dec 14 18:40:40 +0000 2017,hot nude teen models only jailbait girls galleries https://t.co/2j6rs0Smyo
Fri Dec 15 03:18:35 +0000 2017,porno severina nude teen jailbait sex hot https://t.co/UeeOzWpEmr
Fri Dec 15 00:52:47 +0000 2017,angelina valentine anal video jailbaits girls peachez https://t.co/SsnrKmMPg9
Thu Dec 14 11:01:07 +0000 2017,brooke ideepthroat anal naked jailbait girls youtube https://t.co/XCzmmUolUF
Thu Dec 14 11:02:28 +0000 2017,naked jailbait girl pics sex blow jobs https://t.co/nvDGkAm9Oy
Thu Dec 14 16:28:58 +0000 2017,jailbait teen nude free flash porn downloads https://t.co/MecCcm0m2K
Thu Dec 14 16:04:42 +0000 2017,naked pro jailbait school girl sex pica https://t.co/IgvHkJxtsL
Sun Dec 03 17:27:49 +0000 2017,jailbait skinny dip pics porn of old men https://t.co/drlmc4KL7n
Sun Dec 03 16:33:38 +0000 2017,jailbait nude thread blow job video porn https://t.co/fxPeL1mzbn
Fri Dec 01 18:02:19 +0000 2017,Anyone want to cum on asian faces? DM me or kik me: LonelySomeone1029. NO NUDES #cumtribute #jailbait..
Sat Dec 02 03:16:51 +0000 2017,shemale anal clips jailbait teen cheerleader pic https://t.co/ARqnALba00
Sat Dec 02 06:01:24 +0000 2017,mexican girl jailbait having sex anime sex move https://t.co/NnDXgAHsSZ
Sat Dec 30 14:31:26 +0000 2017,free jailbait nude rosario dawson sex clips https://t.co/OJXWRuW90G
Sat Dec 30 11:39:53 +0000 2017,big black dicks in blonde girl jailbait sexy https://t.co/gPAEH2FJt8
Sat Dec 30 19:04:47 +0000 2017,kyra sedgwick nude pics jailbait teen porn https://t.co/627K11WKV7
Sat Dec 30 19:04:03 +0000 2017,hot girl in overalls getting fucked jailbait fingering https://t.co/99YHHEQG5e
Sat Dec 23 00:18:44 +0000 2017,sexy teen busty jailbait nude women legs https://t.co/dZzFM6FAFS
Tue Dec 19 23:11:00 +0000 2017,RT @pantylovingdad: You know you want me #jailbait #young #teengirls https://t.co/zbsCwPpm88
Wed Dec 06 19:48:53 +0000 2017,girl jailbait nude nude girls images portal https://t.co/e1ULM0qXUy
Thu Dec 07 06:47:09 +0000 2017,chanel price porn jailbait girls stripping naked https://t.co/sOOSiuRri7
Mon Dec 25 20:53:48 +0000 2017,fucked naked jailbait pictures of people having oral sex https://t.co/OdFYn0RgNa
Mon Dec 25 22:07:08 +0000 2017,naked girl in toilet gallery jailbait nude photos https://t.co/0j0WrOmZff
Mon Dec 25 13:46:37 +0000 2017,jailbait nude download gallery noami porn star https://t.co/8KhWJC6SoE
Wed Dec 13 03:45:36 +0000 2017,RT @daisyjailbait: 💦 love yourself girls #jailbait #alwayshorny https://t.co/JZFggUWdcJ
Sun Dec 24 06:12:55 +0000 2017,free sex porno pictures free naked jailbait https://t.co/MOxzcNDgsg
Sat Dec 16 10:44:45 +0000 2017,hot nude delhi girls tits jailbait penis https://t.co/ePaRK7xL32
Sun Dec 17 06:24:39 +0000 2017,Does my #ass look big in this? #jailbait #teengirls #young #bikini https://t.co/oA4tbtB6wd
Mon Jan 01 06:07:18 +0000 2018,sexy jailbait teen sex xxx hot girls https://t.co/QxTTjKXRlD
Sun Dec 10 11:41:28 +0000 2017,real nude jailbait girl pictures the best hentai porn https://t.co/ODpsA3BxYe
Sun Dec 10 21:41:13 +0000 2017,danielle fishel naked fuck free jailbait girls sex https://t.co/I8KSCTodSN
Sun Dec 10 16:05:54 +0000 2017,sexy jailbait naked free hot enamel girl porn https://t.co/Xn0Rd4dlWA
Thu Dec 07 22:49:01 +0000 2017,RT @laurathehoe: 40rt and I post more often #ass #teen #jailbait https://t.co/8e1SREhB6L
Fri Dec 08 02:23:10 +0000 2017,They act like animals hanging out at malls trying to pick up jailbait https://t.co/DMHpbpW8Lc
Fri Dec 08 17:55:49 +0000 2017,horney asian womenhaving sex porn nude jailbait forum https://t.co/9CVkZAif3n
Fri Dec 08 14:51:17 +0000 2017,hot jailbait nude phone pictures hot pussy slut https://t.co/28JQ1Bq5Kz
Fri Dec 08 15:25:16 +0000 2017,free naked jailbait nice hot nude horney girls https://t.co/hmatGgXNPe
Fri Dec 08 12:54:26 +0000 2017,RT @Emilyslut22: Old pics when I was first a slut #jailbait #sugardaddy https://t.co/GvmQIvUazJ
Mon Dec 11 14:55:03 +0000 2017,little melissa jailbait forum pakistani naked girls pictures https://t.co/YSuXxF7wGL
Tue Dec 12 01:35:07 +0000 2017,teeny jailbait stripping cecile de france gallery porn https://t.co/O2edGIkpgR
Sat Dec 16 04:24:05 +0000 2017,indian nude black girls pics of jailbait girls having sex https://t.co/Ezm2R38zJU
Fri Dec 15 08:57:51 +0000 2017,aang has sex real nude teen jailbait phone pictures https://t.co/C8vxluukuR
Sun Dec 17 07:57:09 +0000 2017,RT @DadLovesPanties: Seriously dodgy pipework #jailbait #young #teengirls https://t.co/4jw0h1vDM2
Sun Dec 03 01:28:35 +0000 2017,nude teen jailbait sex hot hentai sex tentacle https://t.co/ew7SpI0FR7
Sat Dec 02 21:16:00 +0000 2017,asian tiny sex real nude jailbait pussy galleries https://t.co/yqPSYHq03y
Thu Dec 14 18:44:09 +0000 2017,teenage free porn movies jailbait girls porn pictures https://t.co/KkpcKFneHd
Sun Dec 03 23:45:43 +0000 2017,sexy jailbait nudes free thick white naked women https://t.co/jiCXqaGC0M
Fri Dec 01 09:25:27 +0000 2017,hairy teenie porn thumbnails hot nude jailbait porn https://t.co/oB1n5IVh3v
Sat Dec 02 04:36:21 +0000 2017,kashmiri nude teen pics jailbait girlfriends sex movies https://t.co/q51dgZYJvV
Sat Dec 30 20:22:46 +0000 2017,jailbait sexy nude pictures skinny black teen bum https://t.co/I6XBwNKzac
Sat Dec 30 16:38:10 +0000 2017,teenage free porn movies jailbait girls porn pictures https://t.co/GC1jnS3Zls
Wed Dec 20 01:35:24 +0000 2017,jailbait nude sex naija university girls dancing naked https://t.co/I9tWf9VIKo
Tue Dec 19 19:06:13 +0000 2017,Got to love a moody look #jailbait #young #teengirls #bikini https://t.co/WfkvIfKbhK
Thu Dec 28 11:48:44 +0000 2017,hot jailbait girl pics women sex movie galleries https://t.co/cEHWiGTc82
Mon Dec 25 00:39:43 +0000 2017,forum picture teens jailbait models ashley porn actress https://t.co/Z8M31pmBcK
Mon Dec 25 06:03:13 +0000 2017,jailbait teen sex pictures bikini girl have sex in the road https://t.co/5EX48sa3nd
Wed Dec 06 16:37:59 +0000 2017,RT @Emilyslut22: Old pics when I was first a slut #jailbait #sugardaddy https://t.co/GvmQIvUazJ
Mon Dec 25 20:20:15 +0000 2017,Dm me to trade pics of girls we find hot #horny #cumtribute #cocktribute #nude #teen #jailbait
Sat Dec 23 13:58:11 +0000 2017,sexy school girl jailbait girls having sex with there periods porn https://t.co/hXImgdEBGm
Sun Dec 31 20:10:25 +0000 2017,"RT @MoistCr1TiKaL: Jailbait no more, the 2000s turn 18 tonight, we all know the slut been fucking people before though"
Sun Dec 31 18:19:20 +0000 2017,"RT @MoistCr1TiKaL: Jailbait no more, the 2000s turn 18 tonight, we all know the slut been fucking people before though"
Sun Dec 31 18:48:25 +0000 2017,"RT @MoistCr1TiKaL: Jailbait no more, the 2000s turn 18 tonight, we all know the slut been fucking people before though"
Sun Dec 31 18:23:24 +0000 2017,"RT @MoistCr1TiKaL: Jailbait no more, the 2000s turn 18 tonight, we all know the slut been fucking people before though"
Sun Dec 31 12:25:12 +0000 2017,hairy teenie porn thumbnails hot nude jailbait porn https://t.co/IXN7YLtIMX
Sun Dec 31 21:15:30 +0000 2017,"RT @MoistCr1TiKaL: Jailbait no more, the 2000s turn 18 tonight, we all know the slut been fucking people before though"
Sun Dec 31 21:28:59 +0000 2017,"RT @MoistCr1TiKaL: Jailbait no more, the 2000s turn 18 tonight, we all know the slut been fucking people before though"
Sun Dec 31 21:40:56 +0000 2017,"RT @MoistCr1TiKaL: Jailbait no more, the 2000s turn 18 tonight, we all know the slut been fucking people before though"
Sun Dec 31 21:37:05 +0000 2017,"RT @MoistCr1TiKaL: Jailbait no more, the 2000s turn 18 tonight, we all know the slut been fucking people before though"
Sun Dec 31 21:38:44 +0000 2017,"RT @MoistCr1TiKaL: Jailbait no more, the 2000s turn 18 tonight, we all know the slut been fucking people before though"
Sun Dec 10 11:50:18 +0000 2017,sexy naked jailbait girls girl with boy shorts loves anal https://t.co/Hu4oeUFtWG
Sun Dec 10 07:45:25 +0000 2017,sexy naked jailbait girls girl with boy shorts loves anal https://t.co/8tvv1v1beh
Fri Dec 08 21:33:51 +0000 2017,RT @Melodywantscum: Retweet for more boys💕 #tits #ass #cumtribute #cumslut #cockslut #cocktribute #slut #cumwhore #jailbait… 
Mon Dec 11 08:58:31 +0000 2017,tube of jailbait girls and live sex ganian pretty girls sex https://t.co/RTVp4qH7WF
Fri Dec 15 07:35:40 +0000 2017,bangla girl homemade sex video free pictures of naked jailbait https://t.co/oNX52vJF9j
Tue Dec 05 02:05:50 +0000 2017,jailbait nude on cam teen wwe xxx fuck divas photos https://t.co/8krhc6usXw
Fri Dec 29 23:41:24 +0000 2017,"RT @cockandcumgiver: Who would you fuck?  Rt and dm for more. 

#horny #teen #schoolgirl #schoolgirls #fuckthem #jailbait #jailb8 #sexyteen…"
Sun Dec 31 01:01:29 +0000 2017,free nude jailbait pictures online image search engine adult https://t.co/tJad5liWgp
Tue Dec 19 21:09:38 +0000 2017,RT @skiller1010: Which teen do you pound first? #teen #sexy #ass #jailbait https://t.co/2FWfiK1TJk
Wed Dec 06 17:49:31 +0000 2017,"RT @iowahawkblog: Meanwhile, the GOP gives Judge Jailbait $170,000 and a free ice cream truck"
Mon Dec 25 18:30:17 +0000 2017,RT @Courtnayy215: Thin or thick😘?  Leave your comments below for a chance to get some of this #jailbait #cumslut #sugarbaby #escort #snowbu…
Sun Dec 24 06:18:35 +0000 2017,RT @stacymtell2: rt if you'd suck my wet tits #cumslut #cumtribute #jailbait https://t.co/Qlyyb1B4Yj
Sun Dec 24 06:42:27 +0000 2017,RT @stacymtell2: rt if you'd suck my wet tits #cumslut #cumtribute #jailbait https://t.co/Qlyyb1B4Yj
Sun Dec 31 20:50:59 +0000 2017,RT @cum_gobblers: You better have been thinking of me daddy #cumtribute #cumwhore #cumslut #cocktribute #teen #jailbait #jailbaitslut https…
Sun Dec 31 15:11:17 +0000 2017,jailbait nude on cam teen wwe xxx fuck divas photos https://t.co/sFVL3YfRwL
Sun Dec 31 09:54:37 +0000 2017,teen models video sexy jailbait japanese sex dolls in action https://t.co/ASUr3U84F1
Sun Dec 31 08:04:02 +0000 2017,mom and daughter and son sex best place for jailbait porn nude https://t.co/mzQAkJ3Q3Z
Sun Dec 10 07:59:30 +0000 2017,jailbait tight girls sex woman and snake sex pic porn forum https://t.co/npNDizRglQ
Tue Dec 26 07:18:16 +0000 2017,RT @Milenawantscum: Retweet for more boys💕 #tits #ass #cumtribute #cumslut #cockslut #cocktribute #slut #cumwhore #jailbait #jailbaitslut #…
Sun Dec 17 20:03:07 +0000 2017,Kinky #vidos Jailbait nude imageboards. #Models in music #videos  👉👉👉 https://t.co/KGKNxZdHEl 👈👈👈
Sat Dec 02 16:44:29 +0000 2017,RT @ThickBootyBBW: Retweet if you wanna fuck me 😉 #cumtribute #cocktribute #cumslut #cumwhore #cumdump #cumrag #teengirl #jailbait… 
Sat Dec 30 02:08:39 +0000 2017,RT @CuriousClair: daddy ur little girl needs a drink #cumtribute #jailbait https://t.co/niB7Xlmhe5
Wed Dec 27 17:53:20 +0000 2017,RT @Courtnayy215: Retweet if you still want this😘 #jailbait #cumslut #escort #snowbunny https://t.co/sbAh9zSB4u
Wed Dec 27 21:10:19 +0000 2017,naked teenage jailbait free online videos of girls using sex machines https://t.co/Dl019Uu9xG
Fri Dec 15 01:18:06 +0000 2017,RT @Courtnayy215: Retweet if you still want this😘 #jailbait #cumslut #escort #snowbunny https://t.co/sbAh9zSB4u
Fri Dec 01 09:39:02 +0000 2017,sex with two vaginas porn real young naked jailbait pictures forum https://t.co/83tkQSROl2
Fri Dec 01 09:43:08 +0000 2017,womens sex pages videos and blogs sexy girls jailbait naked forum https://t.co/F81oAFLdMP
Mon Dec 25 09:18:16 +0000 2017,nude jailbait naked women who don t look like john lithgow https://t.co/Lp1sWgw7Kn
Tue Dec 12 21:19:43 +0000 2017,RT @meibutt: can jailbait gfs stay the fuck off this app ?? Like go fucking color or something my GOD
Sat Dec 23 09:51:03 +0000 2017,womens sex pages videos and blogs sexy girls jailbait naked forum https://t.co/NFbl2UKDbk
Sat Dec 16 12:33:28 +0000 2017,RT @CumSlutKatiexD: Absolutely stunning little things :3 #cumtribute #cocktribute #hotteen #bikiniteen #sexyteen #jailbait #jailbate… 
Sat Dec 16 10:46:02 +0000 2017,RT @cumwhoreamy: #cumtribute my friend for nudes! RT!! 😊💕 #cocktribute #pisstribute #wanktribute #cumslut #jailbait #horny #cumonme… 
Sun Dec 10 02:37:11 +0000 2017,"how deep do you wanna be inside of me?

kik: seductivekrys

#cumtribute #jailbait #barelylegal #paypig #findom… https://t.co/Du2gGq72lJ"
Sun Dec 10 06:56:51 +0000 2017,free clips of naked jailbait cartoon girls women doing sex in bathroom picture https://t.co/9Q9L16Dc31
Mon Jan 01 00:13:57 +0000 2018,nude jailbait naked women who don t look like john lithgow https://t.co/QdWt1ulOJ3
Sun Dec 31 19:30:05 +0000 2017,RT @cum_gobblers: Retweet if you would fuck me #cumwhore #cumslut #teen #jailbait #jailbaitslut #cumtribute https://t.co/XxsfqJTgGD
Wed Dec 13 23:57:08 +0000 2017,RT @CuteAvery2002: Bet you wish I could ride you right now? 😍😍#cumtribute #cumslut #cockslut #cocktribute #slut #cumwhore #jailbait… 
Mon Dec 11 16:08:44 +0000 2017,#daddy is so #fucking #horny #such my brain out... DM me and make me #cum #cumtribute #roleplay #wankchat #jailbait… https://t.co/vCkuJFsT5P
Wed Dec 27 01:17:09 +0000 2017,RT @cum_sandra: Here he is sticking it inside me. He was pretty big. #cum #cock #notavirgin #slut #cumtribute #cocktribute #hot #jailbait h…
Wed Dec 27 06:49:27 +0000 2017,RT @cum_sandra: Here he is sticking it inside me. He was pretty big. #cum #cock #notavirgin #slut #cumtribute #cocktribute #hot #jailbait h…
Wed Dec 20 18:12:01 +0000 2017,bangloore college girls nacked body xxx xxx vidio jailbait teen fucked https://t.co/hy9UuTgnjH
Mon Dec 18 00:20:39 +0000 2017,jailbait teens sleeping pics oops carrie ann inaba girlie show nude https://t.co/BE2xuGoHXN
Fri Dec 29 14:03:26 +0000 2017,RT @CuriousClair: Still feeling naughty please give me some cock to help #teenslut #jailbait https://t.co/UHDTaodQTV
Sun Dec 03 22:42:41 +0000 2017,RT @youngcutegirls1: More Cuties? --&gt;&gt; https://t.co/vKh4lspSmL  // #Jailbait #TeenPorn #CutePorn #SlimGirls #ShavedPussy #BlondePorn… 
Fri Dec 01 15:30:14 +0000 2017,bangloore college girls nacked body xxx xxx vidio jailbait teen fucked https://t.co/Xw1efUvf4u
Fri Dec 01 21:03:50 +0000 2017,RT @Melodywantscum: Retweet if you’d titty fuck me #tits #ass #cumtribute #cumslut #cockslut #cocktribute #slut #cumwhore #jailbait… 
Sun Dec 31 04:40:50 +0000 2017,RT @milena26262: Retweet if you love my body #tits #ass #cumtribute #cumslut #cockslut #cocktribute #slut #cumwhore #jailbait #jailbaitslut…
Sun Dec 31 04:16:18 +0000 2017,RT @milena26262: Retweet if you love my body #tits #ass #cumtribute #cumslut #cockslut #cocktribute #slut #cumwhore #jailbait #jailbaitslut…
Sat Dec 30 19:48:26 +0000 2017,RT @cum_gobblers: Retweet if you would cover me #cum #cumshot #cumwhore #teen #jailbait #jailbaitslut #cumtribute https://t.co/wmMdWrhlSG
Mon Dec 25 00:27:24 +0000 2017,So hard and #horny #dm or #kikme fxck_me19 for #roleplay #nudes I’m not fussy #kik #jailbait #Bbw #milf #wankchat #sexting
Sun Dec 24 12:15:37 +0000 2017,RT @Milenawantscum: Cocktribute me Daddy #tits #ass #cumtribute #cumslut #cockslut #cocktribute #slut #cumwhore #jailbait #jailbaitslut htt…
Mon Dec 25 12:44:56 +0000 2017,RT @Milenawantscum: Retweet for more boys💕 #tits #ass #cumtribute #cumslut #cockslut #cocktribute #slut #cumwhore #jailbait #jailbaitslut h…
Mon Dec 25 07:21:52 +0000 2017,RT @Milenawantscum: Retweet for more boys💕 #tits #ass #cumtribute #cumslut #cockslut #cocktribute #slut #cumwhore #jailbait #jailbaitslut h…
Sun Dec 17 06:57:24 +0000 2017,RT @DadLovesPanties: Looks kind of cold and got at the same time #jailbait #young #teengirls #bikini https://t.co/ot8u0gQL64
Thu Dec 07 12:00:52 +0000 2017,RT @youngcutegirls1: More On https://t.co/2ADicpryxb // #Jailbait #YoungPorn #CutePorn #NakedTeens #BlondePorn #HardNipples https://t.co/Kd…
Wed Dec 13 22:48:15 +0000 2017,RT @Stefani06914770: Relaxing!! Any girls me age...13-17?? #underage #teen #teenlez #teenles #nakedselfie #jailbait #lesbian #DMme https://…
Sat Dec 16 01:13:48 +0000 2017,so hard and #horny what girl is gonna #kikme fxck_me19 for #nudes and #roleplay I want anything #milf #bbw #jailbait #dm #kik #sexting
Fri Dec 15 21:37:55 +0000 2017,"Anyone wanting to trade nudes dm me, I'm 15 :) #young #jailbait #horny #nudes #kinky #freaky #underage #preteen #taboo #incest"
Wed Dec 20 10:15:37 +0000 2017,RT @asof_yesterday: Cum on me and my friends. Retweet for a nude #cumtribute # #jailbait #cumonme #teenslut #slut #nude #fuckme https://t.c…
Tue Dec 05 22:35:40 +0000 2017,Anybody up to #wankchat over my hot #jailbait sis or gf dm me they are always open #cumtribute #cocktribute #slut… https://t.co/lhDLXqkK4I
